conversation_history	query	rewrited_query	answer	unique_idx	candidates	refered_turn	plan
"['turn 1: I need a reminder in 45 minutes called Stretch Break. -> Reminder set: Stretch Break in 45 minutes.', ""turn 2: List 'Stretch Break in 45 minutes'. -> Active timer: Stretch Break set for 45 minutes."", ""turn 3: Add a 20-minute timer named Focus Session -> Focus Session timer created for 20 minutes—you're all set!""]"	What about that Stretch Break reminder?	What about the Stretch Break reminder in 45 minutes?	{'plan': 'ACTION_SHOW_TIMERS', 'arguments': {}}	ACTION_SET_TIMER-615-ACTION_SHOW_TIMERS-1-ACTION_SET_TIMER-1-ACTION_SHOW_TIMERS-1	['ACTION_SHOW_TIMERS', 'play_video', 'ACTION_EDIT_VIDEO', 'dial', 'open_settings']	1.0	ACTION_SHOW_TIMERS
"['turn 1: Please list all active timers I have set. -> Active timers: [3 minutes\xa0– Boiling Eggs, 15 minutes\xa0– Laundry, 25 minutes\xa0– Pizza Dough]', 'turn 2: Add a 20-minute timer for stretching -> 20-minute stretching timer now active.', ""turn 3: Can you show me '3 minutes\xa0– Boiling Eggs', '15 minutes\xa0– Laundry', '25 minutes\xa0– Pizza Dough', and '20-minute stretching timer'? -> You currently have: [3 minutes – Boiling Eggs, 15 minutes – Laundry, 25 minutes – Pizza Dough, 20 minutes – Stretching].""]"	Please display that stretching timer.	Please display the 20-minute stretching timer.	{'plan': 'ACTION_SHOW_TIMERS', 'arguments': {}}	ACTION_SHOW_TIMERS-1839-ACTION_SET_TIMER-1-ACTION_SHOW_TIMERS-1-ACTION_SHOW_TIMERS-1	['ACTION_VIEW_CONTACT', 'ACTION_INSERT_EVENT', 'play_video', 'ACTION_SET_RINGTONE', 'ACTION_SHOW_TIMERS']	2.0	ACTION_SHOW_TIMERS
['turn 1: Open up the default system camera for video. -> Video camera initialized. Let’s roll!']	Capture it for me.	Capture the video for me.	{'plan': 'ACTION_VIDEO_CAPTURE', 'arguments': {}}	INTENT_ACTION_VIDEO_CAMERA-910-ACTION_VIDEO_CAPTURE-1	['ACTION_VIEW_PLAYLIST', 'send_email', 'ACTION_OPEN_CONTENT', 'ACTION_VIDEO_CAPTURE', 'ACTION_OPEN_DOCUMENT']		ACTION_VIDEO_CAPTURE
['turn 1: Invoke the video camera software. -> Video camera software is up and running.']	Record it now.	Record video camera software now.	{'plan': 'ACTION_VIDEO_CAPTURE', 'arguments': {}}	INTENT_ACTION_VIDEO_CAMERA-902-ACTION_VIDEO_CAPTURE-1	['ACTION_SHOW_TIMERS', 'ACTION_INSERT_CONTACT', 'ACTION_VIDEO_CAPTURE', 'ACTION_VIEW_RECENT_APPS', 'dial']		ACTION_VIDEO_CAPTURE
"['turn 1: Retrieve details of my latest sent text messages. -> Sent messages: Sam – ""Pick up milk and bread""; Office – ""Lunch postponed till 1\xa0PM""; Emma – ""Congrats on the new role!""', 'turn 2: I want to record a short film; start my camera in video mode. -> Video mode is up—ready for your short film shoot.']"	Begin recording it.	Begin recording the short film.	{'plan': 'ACTION_VIDEO_CAPTURE', 'arguments': {}}	ACTION_VIEW_SENT_MESSAGES-2051-INTENT_ACTION_VIDEO_CAMERA-1_NR-ACTION_VIDEO_CAPTURE-1	['play_music', 'ACTION_GET_RINGTONE', 'ACTION_VIEW_CONTACT', 'ACTION_VIDEO_CAPTURE', 'send_message']		ACTION_VIDEO_CAPTURE
"['turn 1: Pull up content://contacts/people/1006. -> Contact 1006 loaded: Michael Lee\n📞 555-0106\n✉️ michael.lee@example.com', ""turn 2: I need to record an event; open my device's video camera function. -> Opening video camera now—go ahead and start filming.""]"	Record the event now and save it there.	Record the event now and save it at content://contacts/people/1006.	{'plan': 'ACTION_VIDEO_CAPTURE', 'arguments': {'file_uri': 'content://contacts/people/1006'}}	ACTION_VIEW_CONTACT-763-INTENT_ACTION_VIDEO_CAMERA-1_NR-ACTION_VIDEO_CAPTURE-1	['INTENT_ACTION_STILL_IMAGE_CAMERA', 'play_music', 'ACTION_PICK', 'open_settings', 'ACTION_VIDEO_CAPTURE']		ACTION_VIDEO_CAPTURE
"[""turn 1: Can you get the video camera up and running? -> You're all set—the video camera is open.""]"	Go ahead and record it.	Go ahead and record the video camera.	{'plan': 'ACTION_VIDEO_CAPTURE', 'arguments': {}}	INTENT_ACTION_VIDEO_CAMERA-912-ACTION_VIDEO_CAPTURE-1	['ACTION_OPEN_CONTENT', 'send_message', 'ACTION_INSERT_EVENT', 'ACTION_CREATE_DOCUMENT', 'ACTION_VIDEO_CAPTURE']		ACTION_VIDEO_CAPTURE
"[""turn 1: Book 'Photography Class' on October 10, 2024 from 9 AM–12 PM at Downtown Studio. Description: Portrait techniques. -> Photography Class (Portrait techniques) booked for October\xa010,\xa02024, 9:00\xa0AM–12:00\xa0PM at Downtown Studio. Event URI: content://calendar/event/6"", 'turn 2: Display details for content://calendar/event/6. -> Photography Class details: October\xa010,\xa02024, 9:00\xa0AM–12:00\xa0PM at Downtown Studio (Portrait techniques).', 'turn 3: Activate the video recording mode on my phone, please. -> Video recording mode activated. You’re good to go!']"	Start recording and stop it after thirty seconds.	Start recording and stop the video recording after thirty seconds.	{'plan': 'ACTION_VIDEO_CAPTURE', 'arguments': {}}	ACTION_INSERT_EVENT-481-ACTION_VIEW_EVENT-1-INTENT_ACTION_VIDEO_CAMERA-1_NR-ACTION_VIDEO_CAPTURE-1	['ACTION_OPEN_DOCUMENT', 'launch_application', 'ACTION_VIDEO_CAPTURE', 'ACTION_VIEW_CALL_LOG', 'play_video']		ACTION_VIDEO_CAPTURE
"[""turn 1: Please switch the ringtone to this OGG clip: content://storage/emulated/0/Movies/ringtone.ogg -> All set! Incoming calls will now ring with 'ringtone.ogg'."", ""turn 2: Browse available ringtones -> Sure thing—'ringtone2.ogg' is now your tone (content://storage/emulated/0/Movies/ringtone2.ogg)"", ""turn 3: Set content://storage/emulated/0/Movies/ringtone2.ogg as my default ringtone -> Success! Your default ringtone has been changed to 'ringtone2.ogg'."", 'turn 4: Please enable the video camera on my phone for a recording session. -> Your camera is in video recording mode. Ready when you are.']"	Go ahead and record it	Go ahead and record the video.	{'plan': 'ACTION_VIDEO_CAPTURE', 'arguments': {}}	ACTION_SET_RINGTONE-1577-ACTION_GET_RINGTONE-1-ACTION_SET_RINGTONE-1-INTENT_ACTION_VIDEO_CAMERA-1_NR-ACTION_VIDEO_CAPTURE-1	['ACTION_INSERT_EVENT', 'web_search', 'ACTION_VIDEO_CAPTURE', 'play_music', 'ACTION_VIEW_SENT_MESSAGES']		ACTION_VIDEO_CAPTURE
['turn 1: Give me a timer of 45 minutes and call it Pasta. -> Timer set for 45 minutes: Pasta.', 'turn 2: Could you show me my current timers? -> Your current timers: [45 minutes – Pasta].', 'turn 3: Set a 30-minute timer for laundry without confirmation -> Laundry timer set for 30 minutes—no further prompts.', 'turn 4: I need to document an event quickly—launch the video camera app on my device. -> Video recording interface launched. Begin recording your event.']	Record the event with it.	Record the event with the video camera app.	{'plan': 'ACTION_VIDEO_CAPTURE', 'arguments': {}}	ACTION_SET_TIMER-606-ACTION_SHOW_TIMERS-1-ACTION_SET_TIMER-1-INTENT_ACTION_VIDEO_CAMERA-1_NR-ACTION_VIDEO_CAPTURE-1	['ACTION_SET_ALARM', 'ACTION_OPEN_CONTENT', 'ACTION_VIDEO_CAPTURE', 'ACTION_GET_RINGTONE', 'ACTION_INSERT_EVENT']		ACTION_VIDEO_CAPTURE
['turn 1: Photograph this bar code and store at content://codes/barcode/bar_001.png -> Barcode photo taken—find it at content://codes/barcode/bar_001.png.', 'turn 2: Please launch LinkedIn so I can update my professional profile. -> LinkedIn launched—ready for your profile updates.', 'turn 3: Start the video camera app immediately so I can record something. -> Video app opened. You’re all set to record!']	Capture it now.	Capture the video camera app now.	{'plan': 'ACTION_VIDEO_CAPTURE', 'arguments': {}}	ACTION_IMAGE_CAPTURE-374-launch_application-1_NR-INTENT_ACTION_VIDEO_CAMERA-1_NR-ACTION_VIDEO_CAPTURE-1	['ACTION_VIEW_PLAYLIST', 'ACTION_SET_TIMER', 'ACTION_PICK', 'ACTION_VIDEO_CAPTURE', 'dial']		ACTION_VIDEO_CAPTURE
['turn 1: Bring me the video shooting app. -> Your device’s video camera is up and running.']	Capture it now.	Capture video now.	{'plan': 'ACTION_VIDEO_CAPTURE', 'arguments': {}}	INTENT_ACTION_VIDEO_CAMERA-906-ACTION_VIDEO_CAPTURE-1	['ACTION_SET_TIMER', 'ACTION_VIEW_EVENT', 'ACTION_VIDEO_CAPTURE', 'send_message', 'INTENT_ACTION_STILL_IMAGE_CAMERA']		ACTION_VIDEO_CAPTURE
['turn 1: Could you ring Beijing office +86 10 8888 6666? -> Calling the Beijing office at +86 10 8888 6666...', 'turn 2: Can you display the active countdown timers for me? -> Currently running countdowns:\n- 4 minutes remaining: Pasta\n- 20 minutes remaining: Laundry cycle\n- 30 minutes remaining: Workout interval', 'turn 3: Add one more 15-minute timer for cooking -> Cooking timer set for 15 minutes.']	View my call history	View the device's call history	{'plan': 'ACTION_VIEW_CALL_LOG', 'arguments': {}}	dial-942-ACTION_SHOW_TIMERS-1_NR-ACTION_SET_TIMER-1-ACTION_VIEW_CALL_LOG-1	['send_message', 'ACTION_VIEW_CALL_LOG', 'ACTION_VIEW_SENT_EMAILS', 'get_contact_info_from_uri', 'ACTION_CREATE_DOCUMENT']	1.0	ACTION_VIEW_CALL_LOG
['turn 1: Make a call to 030-1234-5678 now! -> Placing a call to 030-1234-5678...', 'turn 2: What calls have I made and received recently? -> Recent calls: 030-1234-5678 (Outgoing) - Today 2:30 PM; 212-555-0182 (Missed) - Today 1:15 PM; Dad +1-415-555-0198 (Incoming) - Sep 12, 6:45 PM']	Let me see the recent calls including that one	Let me see the recent calls including the call to 030-1234-5678	{'plan': 'ACTION_VIEW_CALL_LOG', 'arguments': {}}	dial-928-ACTION_VIEW_CALL_LOG-1-ACTION_VIEW_CALL_LOG-1	['ACTION_VIEW_CALL_LOG', 'ACTION_VIEW_CONTACT', 'ACTION_INSERT_CONTACT', 'ACTION_INSERT_EVENT', 'ACTION_SHOW_ALARMS']	1.0	ACTION_VIEW_CALL_LOG
"['turn 1: Dial +33 (1) 44 20 77 00 to reach the Paris office. -> Connecting to the Paris office at +33 (1) 44 20 77 00...', ""turn 2: I'm interested in the advancements in 3D printing; can you check that online? -> Search results for 'advancements in 3D printing': Explore new materials, faster print speeds, and innovative industrial applications.""]"	Show me the call history for that number	Show me the call history for +33 (1) 44 20 77 00	{'plan': 'ACTION_VIEW_CALL_LOG', 'arguments': {}}	dial-940-web_search-1_NR-ACTION_VIEW_CALL_LOG-1	['open_settings', 'ACTION_NAVIGATE_TO_LOCATION', 'ACTION_VIEW_CALL_LOG', 'ACTION_VIDEO_CAPTURE', 'ACTION_SET_RINGTONE']	1.0	ACTION_VIEW_CALL_LOG
['turn 1: Give me a summary of the contact at content://contacts/people/42. -> Here’s what I found:\n• Name: Michael Lee\n• Phone: 555-987-6543\n• Email: michael.lee42@example.com\n• Address: 321 Oak St, Centerville, OH 45459', 'turn 2: Call 555-987-6543 -> Placing a call to 555-987-6543...', 'turn 3: Show me the recent call history -> Call history:\n1. 555-987-6543 (Outgoing) – Today 5:50 PM\n2. Jane Doe +1-415-555-3322 (Missed) – Today 2:30 PM\n3. Support +61-2-9374-4000 (Incoming) – Yesterday 8:00 AM']	What's my call log?	What’s my call log?	{'plan': 'ACTION_VIEW_CALL_LOG', 'arguments': {}}	get_contact_info-970-dial-1-ACTION_VIEW_CALL_LOG-1-ACTION_VIEW_CALL_LOG-1	['play_video', 'ACTION_VIEW_CONTACT', 'INTENT_ACTION_VIDEO_CAMERA', 'ACTION_VIEW_CALL_LOG', 'ACTION_VIEW_SENT_MESSAGES']	2.0	ACTION_VIEW_CALL_LOG
"[""turn 1: Fire up the device's default still camera application. -> Camera started in photo mode."", 'turn 2: Could you please retrieve the information detailed in contact://details/quincy? -> Details for Quincy: Quincy Adams – quincy.adams@example.org, +1‑212‑555‑0142.', 'turn 3: Call +1‑212‑555‑0142 -> Dialing +1‑212‑555‑0142...']"	Let me check its log.	Let me check +1‑212‑555‑0142's log.	{'plan': 'ACTION_VIEW_CALL_LOG', 'arguments': {}}	INTENT_ACTION_STILL_IMAGE_CAMERA-856-get_contact_info_from_uri-1_NR-dial-1-ACTION_VIEW_CALL_LOG-1	['play_video', 'ACTION_SET_RINGTONE', 'send_email', 'ACTION_VIEW_CALL_LOG', 'INTENT_ACTION_STILL_IMAGE_CAMERA']		ACTION_VIEW_CALL_LOG
"['turn 1: Phone the helpline on 777-8888. -> Calling 777-8888...', ""turn 2: Send 777-8888 a text saying 'I wasn't able to get through, please let me know.' -> Your message to 777-8888 has been sent.""]"	Show the call I just placed	Show the call I just placed to 777-8888	{'plan': 'ACTION_VIEW_CALL_LOG', 'arguments': {}}	dial-925-send_message-1-ACTION_VIEW_CALL_LOG-1	['ACTION_VIEW_CALL_LOG', 'ACTION_VIEW_SENT_EMAILS', 'ACTION_VIEW_SENT_MESSAGES', 'send_message', 'ACTION_SET_ALARM']	1.0	ACTION_VIEW_CALL_LOG
"['turn 1: Bring up the device’s missed and dialed calls list. -> Call log: Jack +1-718-555-0145 (Outgoing) - Today 1:00 PM; Karen +49-30-1234-5678 (Incoming) - Yesterday 9:45 AM; Leo +1-305-555-0199 (Missed) - Today 7:20 AM', ""turn 2: Return Leo +1-305-555-0199's call -> Dialing +1-305-555-0199..."", ""turn 3: I'm looking to attach documents in both PDF and plain text formats; let me pick multiple files. -> Opening the file selector—select the PDFs and plain text documents you want to attach."", ""turn 4: Email the PDFs and plain text documents to client@company.com with subject 'Project Documents' and a short message 'Attached are the requested files.' -> Email sent to client@company.com with your “Project Documents” attached and message included.""]"	Show my last calls including that return call.	Show my last calls including Leo +1-305-555-0199's call.	{'plan': 'ACTION_VIEW_CALL_LOG', 'arguments': {}}	ACTION_VIEW_CALL_LOG-1894-dial-1-ACTION_OPEN_DOCUMENT-1_NR-send_email-1-ACTION_VIEW_CALL_LOG-1	['ACTION_EDIT_ALARM', 'play_video', 'ACTION_VIEW_CALL_LOG', 'get_contact_info', 'ACTION_VIEW_SENT_EMAILS']	2.0	ACTION_VIEW_CALL_LOG
"['turn 1: Bring up the device’s missed and dialed calls list. -> Call log: Jack +1-718-555-0145 (Outgoing) - Today 1:00 PM; Karen +49-30-1234-5678 (Incoming) - Yesterday 9:45 AM; Leo +1-305-555-0199 (Missed) - Today 7:20 AM', ""turn 2: Return Leo +1-305-555-0199's call -> Dialing +1-305-555-0199..."", ""turn 3: Save +1-305-555-0199 -> I've created a contact for +1-305-555-0199. Reference: content://contacts/people/103""]"	Show my recent calls	Show the device's recent call log	{'plan': 'ACTION_VIEW_CALL_LOG', 'arguments': {}}	ACTION_VIEW_CALL_LOG-1894-dial-1-ACTION_INSERT_CONTACT-1-ACTION_VIEW_CALL_LOG-1	['ACTION_VIEW_EVENT', 'ACTION_VIEW_CALL_LOG', 'ACTION_IMAGE_CAPTURE', 'play_video', 'ACTION_VIEW_WEB_HISTORY']	2.0	ACTION_VIEW_CALL_LOG
"['turn 1: Expose my web surfing history. -> Sure thing! Your last visited sites are: Wikipedia (Neural Networks); Reddit (r/AskScience); New York Times (top stories); Udemy (Python course overview)', 'turn 2: Select one person from my contacts database. -> Okay, here are your contacts. Please choose one person to continue.', 'turn 3: Dial 323-123-9876 -> Dialing 323-123-9876...', ""turn 4: Create a new contact called Pizza Delivery using 323-123-9876 -> Your new 'Pizza Delivery' contact (323-123-9876) has been created—check it here: content://contacts/people/pizza_delivery.""]"	Let me see the log of that call	Let me see the log of 323-123-9876 call	{'plan': 'ACTION_VIEW_CALL_LOG', 'arguments': {}}	ACTION_VIEW_WEB_HISTORY-2064-ACTION_PICK-1_NR-dial-1-ACTION_INSERT_CONTACT-1-ACTION_VIEW_CALL_LOG-1	['ACTION_GET_CONTENT', 'open_settings', 'ACTION_VIEW_PLAYLIST', 'send_email', 'ACTION_VIEW_CALL_LOG']	3.0	ACTION_VIEW_CALL_LOG
['turn 1: Show the meeting information for event 737. -> Here’s the info for event 737: Project Kickoff with the Marketing Team — July 8 at 10:00\xa0AM in Meeting Room 3.', 'turn 2: I need to review the phone data from contact://phone/cell/999888. -> Cell number: (999)\xa0888‑7777.', 'turn 3: Give (999)\xa0888‑7777 a ring -> Calling (999)\xa0888‑7777 now...']	Display its call details.	Display (999) 888‑7777's call details.	{'plan': 'ACTION_VIEW_CALL_LOG', 'arguments': {}}	ACTION_VIEW_EVENT-1825-get_contact_info_from_uri-1_NR-dial-1-ACTION_VIEW_CALL_LOG-1	['get_contact_info_from_uri', 'ACTION_PICK', 'dial', 'ACTION_VIEW_CALL_LOG', 'ACTION_VIEW_WEB_HISTORY']		ACTION_VIEW_CALL_LOG
['turn 1: Save Carlos Mendoza; tel: 333-222-1111; address is 789 Vinegar Hill Rd. -> Carlos Mendoza has been saved to your contacts: content://contacts/people/carlos_mendoza', 'turn 2: Add company info to content://contacts/people/carlos_mendoza: Acme Corp. -> All set! Carlos Mendoza’s company is now listed as Acme Corp. View the update at content://contacts/people/carlos_mendoza', 'turn 3: Open content://contacts/people/carlos_mendoza to verify the company -> Alright, loading Carlos Mendoza’s contact details: content://contacts/people/carlos_mendoza']	Open his contact	Open content://contacts/people/carlos_mendoza contact	{'plan': 'ACTION_VIEW_CONTACT', 'arguments': {'contact_uri': 'content://contacts/people/carlos_mendoza'}}	ACTION_INSERT_CONTACT-404-ACTION_EDIT_CONTACT-1-ACTION_VIEW_CONTACT-1-ACTION_VIEW_CONTACT-1	['ACTION_PICK', 'play_music', 'ACTION_VIEW_CONTACT', 'ACTION_SHOW_TIMERS', 'search_location']	1.0	ACTION_VIEW_CONTACT
"['turn 1: Please video record our meeting. -> Starting video recording for your meeting now.', 'turn 2: Can you help me pick a contact from my saved directory? -> Sure—contact picker opened. You selected content://contacts/people/12.', ""turn 3: Update content://contacts/people/12's phone number to 555-6789. -> Phone number for the contact has been changed to 555-6789. (content://contacts/people/12)""]"	Show me the details of that contact.	Show me the details of the contact with URI content://contacts/people/12.	{'plan': 'ACTION_VIEW_CONTACT', 'arguments': {'contact_uri': 'content://contacts/people/12'}}	ACTION_VIDEO_CAPTURE-750-ACTION_PICK-1_NR-ACTION_EDIT_CONTACT-1-ACTION_VIEW_CONTACT-1	['ACTION_VIEW_CONTACT', 'ACTION_GET_CONTENT', 'ACTION_PICK', 'ACTION_EDIT_DOCUMENT', 'INTENT_ACTION_VIDEO_CAMERA']	2.0	ACTION_VIEW_CONTACT
"['turn 1: Please start playing on the default player. -> Alright, launching your default music player now.', ""turn 2: Show me the songs in my default playlist -> Playlist 'Default Playlist': Smells Like Teen Spirit; Sweet Child O' Mine; Back in Black"", 'turn 3: I want you to pick a phone contact detail from my phone book. -> Your chosen phone contact: content://contacts/phone/29', 'turn 4: Place a call to content://contacts/phone/29 -> Connecting you to content://contacts/phone/29...']"	Show me their full contact details	Show me the full contact details of content://contacts/phone/29	{'plan': 'ACTION_VIEW_CONTACT', 'arguments': {'contact_uri': 'content://contacts/phone/29'}}	play_music-1401-ACTION_VIEW_PLAYLIST-1-ACTION_PICK-1_NR-dial-1-ACTION_VIEW_CONTACT-1	['play_music', 'ACTION_SHOW_TIMERS', 'dial', 'ACTION_GET_RINGTONE', 'ACTION_VIEW_CONTACT']	3.0	ACTION_VIEW_CONTACT
"[""turn 1: Can you help me edit the contact content://contacts/people/mary_bell? I want to add her work email mary@bellcorp.com. -> Got it, launching Mary's contact. You can add her work email mary@bellcorp.com right away."", 'turn 2: Email mary@bellcorp.com a welcome note about our upcoming call. -> Welcome note successfully emailed to mary@bellcorp.com.']"	Show me her updated contact details	Show me content://contacts/people/mary_bell updated contact details	{'plan': 'ACTION_VIEW_CONTACT', 'arguments': {'contact_uri': 'content://contacts/people/mary_bell'}}	ACTION_EDIT_CONTACT-57-send_email-1-ACTION_VIEW_CONTACT-1	['ACTION_SHOW_ALARMS', 'search_location', 'ACTION_VIEW_CONTACT', 'ACTION_INSERT_CONTACT', 'send_message']	1.0	ACTION_VIEW_CONTACT
['turn 1: Switch default ringtone to classic tune located here: content://com.android.externalstorage.documents/tree/primary%3AMusic%2Fclassic_tune.mp3 -> Classic tune is now set as your ringtone. Enjoy!', 'turn 2: I want to choose a person by hand from my contacts. -> Contact URI: content://contacts/people/5', 'turn 3: Pick out an email on my contact list. -> Okay, here’s the email you picked: content://contacts/email/5']	Display that person's contact details.	Display the contact details of the person at content://contacts/people/5.	{'plan': 'ACTION_VIEW_CONTACT', 'arguments': {'contact_uri': 'content://contacts/people/5'}}	ACTION_SET_RINGTONE-1611-ACTION_PICK-1_NR-ACTION_PICK-1_NR-ACTION_VIEW_CONTACT-1	['get_contact_info', 'ACTION_VIEW_CONTACT', 'ACTION_SET_TIMER', 'send_email', 'web_search']	2.0	ACTION_VIEW_CONTACT
"[""turn 1: Please change Kate's phone from 9876543210 to 0123456789 at content://contacts/people/kate_l. -> Done! Kate’s phone number has been updated to 0123456789."", 'turn 2: Open content://contacts/people/kate_l contact’s info. -> All set—here’s Kate L.’s contact info (content://contacts/people/kate_l).']"	View her contact info	View content://contacts/people/kate_l contact info	{'plan': 'ACTION_VIEW_CONTACT', 'arguments': {'contact_uri': 'content://contacts/people/kate_l'}}	ACTION_EDIT_CONTACT-67-ACTION_VIEW_CONTACT-1-ACTION_VIEW_CONTACT-1	['ACTION_VIEW_SENT_EMAILS', 'ACTION_CREATE_DOCUMENT', 'ACTION_VIEW_RECENT_APPS', 'ACTION_VIEW_CONTACT', 'send_message']	1.0	ACTION_VIEW_CONTACT
['turn 1: Could you pull email info from content://com.company.contacts/contact/432? -> Got it—contact 432’s email is sarah.connors@company.com.', 'turn 2: Open content://com.company.contacts/contact/432 -> Sarah Connors’ info:\nPhone: 555‑210‑9876\nEmail: sarah.connors@company.com\nAddress: 500 Silicon Valley Rd, Palo Alto, CA', 'turn 3: I’d like you to choose a phone number from my contacts. -> Received! Here’s the phone info you wanted: content://contacts/phone/55', 'turn 4: Call content://contacts/phone/55 -> Initiating call to content://contacts/phone/55...']	Open that contact’s profile	Open content://com.company.contacts/contact/432 profile	{'plan': 'ACTION_VIEW_CONTACT', 'arguments': {'contact_uri': 'content://com.company.contacts/contact/432'}}	get_contact_info-1006-ACTION_VIEW_CONTACT-1-ACTION_PICK-1_NR-dial-1-ACTION_VIEW_CONTACT-1	['send_message', 'ACTION_NAVIGATE_TO_LOCATION', 'ACTION_VIDEO_CAPTURE', 'ACTION_SET_ALARM', 'ACTION_VIEW_CONTACT']	3.0	ACTION_VIEW_CONTACT
"[""turn 1: Can you retrieve the email address of the contact for this URI: content://contacts/people/23? -> Sure thing—I've pulled up the email for that contact. It’s jane.doe23@example.com."", 'turn 2: Add phone number 555-123-4567 to content://contacts/people/23. -> All set—phone number 555-123-4567 added to the contact at content://contacts/people/23.']"	Open that contact	Open content://contacts/people/23	{'plan': 'ACTION_VIEW_CONTACT', 'arguments': {'contact_uri': 'content://contacts/people/23'}}	get_contact_info-968-ACTION_EDIT_CONTACT-1-ACTION_VIEW_CONTACT-1	['ACTION_SET_TIMER', 'ACTION_INSERT_CONTACT', 'ACTION_GET_RINGTONE', 'ACTION_VIEW_CONTACT', 'ACTION_SHOW_TIMERS']	1.0	ACTION_VIEW_CONTACT
"[""turn 1: Can I see the 'Movie Soundtracks' tracks? -> Movie Soundtracks includes: Time; My Heart Will Go On; Now We Are Free."", ""turn 2: Fetch web results regarding the current best practices in cybersecurity. -> Looking up 'current best cybersecurity practices'... Listing resources on zero trust, encryption standards, and threat mitigation."", 'turn 3: I want to choose a person by hand from my contacts. -> Sure thing—opening your contacts so you can pick the person you want. Once done, here’s the URI: content://contacts/people/9', 'turn 4: Show me the details of content://contacts/people/9. -> Opening contact details for Alice Johnson: +1-303-555-0142; alice.johnson@domain.com (content://contacts/people/9)']"	Open that contact to display their details.	Open content://contacts/people/9 to display Alice Johnson's details.	{'plan': 'ACTION_VIEW_CONTACT', 'arguments': {'contact_uri': 'content://contacts/people/9'}}	ACTION_VIEW_PLAYLIST-2141-web_search-1_NR-ACTION_PICK-1_NR-ACTION_VIEW_CONTACT-1-ACTION_VIEW_CONTACT-1	['ACTION_VIEW_WEB_HISTORY', 'search_location', 'ACTION_VIEW_RECENT_APPS', 'ACTION_VIEW_CONTACT', 'ACTION_SHOW_TIMERS']	3.0	ACTION_VIEW_CONTACT
['turn 1: Please change my incoming call ringtone to the audio file at content://media/external/audio/media/45. -> All set! Your incoming call ringtone has been changed to the audio file at content://media/external/audio/media/45.', 'turn 2: Can you show me some other ringtones besides content://media/external/audio/media/45? -> Great! Here’s the new ringtone: content://media/external/audio/media/52', 'turn 3: Find me a single contact from my directory database, please. -> On it—opening your contacts list. Please tap the person you want… Here’s the contact URI: content://contacts/people/3', 'turn 4: Update content://contacts/people/3 name to Charlie Davis and company to Delta LLC -> All updated! Contact (content://contacts/people/3) is now Charlie Davis at Delta LLC.']	Display that contact's profile	Display content://contacts/people/3 contact's profile	{'plan': 'ACTION_VIEW_CONTACT', 'arguments': {'contact_uri': 'content://contacts/people/3'}}	ACTION_SET_RINGTONE-1566-ACTION_GET_RINGTONE-1-ACTION_PICK-1_NR-ACTION_EDIT_CONTACT-1-ACTION_VIEW_CONTACT-1	['ACTION_PICK', 'ACTION_VIEW_CONTACT', 'open_settings', 'launch_application', 'ACTION_SET_TIMER']	3.0	ACTION_VIEW_CONTACT
"[""turn 1: Set up 'Gardening Meetup' June 8, 2024 at 10 AM to 12 PM at Community Garden, details: Planting season prep. -> Gardening Meetup (Planting season prep) scheduled for June\xa08,\xa02024 from 10:00\xa0AM to 12:00\xa0PM at Community Garden. Event URI: content://calendar/event/10"", ""turn 2: Please arrange a 'Coding Workshop' focused on Python at Tech Hub. The event is scheduled to run from 1700900000000 to 1700907200000. -> Your 'Coding Workshop' (Learning session focused on Python) is confirmed at Tech Hub from 1700900000000 to 1700907200000. Event URI: content://calendar/event/7"", 'turn 3: What’s the address for Community Garden? -> I’ve got Community Garden here: 256 Greenway Lane, Springfield, IL 62704.']"	Display the details of that Gardening Meetup event.	Display the details of the Gardening Meetup event content://calendar/event/10.	{'plan': 'ACTION_VIEW_EVENT', 'arguments': {'event_uri': 'content://calendar/event/10'}}	ACTION_INSERT_EVENT-485-ACTION_INSERT_EVENT-1_NR-search_location-1-ACTION_VIEW_EVENT-1	['INTENT_ACTION_STILL_IMAGE_CAMERA', 'ACTION_VIEW_EVENT', 'dial', 'ACTION_VIEW_PLAYLIST', 'ACTION_VIDEO_CAPTURE']	1.0	ACTION_VIEW_EVENT
