conversation_history	query	rewrited_query	answer	unique_idx	candidates	refered_turn	plan
"['turn 1: Phone the helpline on 777-8888. -> Calling 777-8888...', 'turn 2: Save 777-8888 to my address book. -> Contact for 777-8888 saved. (URI: content://contacts/people/7778888)', ""turn 3: Name content://contacts/people/7778888 'Helpline Support'. -> Updated contact name to ‘Helpline Support’. (content://contacts/people/7778888)"", ""turn 4: Send content://contacts/people/7778888 a message saying 'Your support schedule is confirmed.' -> Message successfully sent to Helpline Support (content://contacts/people/7778888).""]"	Add helpline with this number.	Add helpline with 777-8888.	{'plan': 'ACTION_INSERT_CONTACT', 'arguments': {'contact_info': {'name': 'helpline', 'phone': '777-8888'}}}	dial-925-ACTION_INSERT_CONTACT-1-ACTION_EDIT_CONTACT-1-send_message-1-ACTION_INSERT_CONTACT-1	['INTENT_ACTION_STILL_IMAGE_CAMERA', 'ACTION_SET_ALARM', 'ACTION_EDIT_VIDEO', 'ACTION_INSERT_CONTACT', 'ACTION_GET_RINGTONE']	1.0	ACTION_INSERT_CONTACT
['turn 1: Connect me to the lab: 555 000 1111. -> Connecting to 555 000 1111...', 'turn 2: Can you display my call history, please? -> Sure thing! Your recent calls: Lab +1-555-000-1111 (Outgoing) - Today 10:10 AM; Alex +1-555-000-2222 (Missed) - Today 8:00 AM; Rachel +1-555-000-3333 (Incoming) - Yesterday 5:45 PM']	Add this lab number to contacts	Add 555 000 1111 to my contacts	{'plan': 'ACTION_INSERT_CONTACT', 'arguments': {'contact_info': {'phone': '555 000 1111'}}}	dial-962-ACTION_VIEW_CALL_LOG-1-ACTION_INSERT_CONTACT-1	['ACTION_SET_TIMER', 'ACTION_INSERT_EVENT', 'ACTION_IMAGE_CAPTURE', 'ACTION_SHOW_TIMERS', 'ACTION_INSERT_CONTACT']	1.0	ACTION_INSERT_CONTACT
['turn 1: Add Lucas Wright to my address book with phone: 321-654-0987 and home address: 456 Maple Street. -> Creating Lucas Wright’s contact: phone 321‑654‑0987 and address 456 Maple Street are filled in.', 'turn 2: Dial 321-654-0987 now -> Calling 321-654-0987 now...', 'turn 3: Add 321-654-0987 to my contacts -> Creating a new contact entry: telephone 321-654-0987 is pre-populated.', 'turn 4: Open 456 Maple Street on map -> Loading map view for 456 Maple Street.']	Save this number as Work Hotline	Save 321-654-0987 as Work Hotline	{'plan': 'ACTION_INSERT_CONTACT', 'arguments': {'contact_info': {'name': 'Work Hotline', 'phone': '321-654-0987'}}}	ACTION_INSERT_CONTACT-392-dial-1-ACTION_INSERT_CONTACT-1-search_location-1-ACTION_INSERT_CONTACT-1	['ACTION_INSERT_CONTACT', 'ACTION_VIEW_CONTACT', 'ACTION_GET_CONTENT', 'ACTION_CREATE_DOCUMENT', 'get_contact_info']	2.0	ACTION_INSERT_CONTACT
['turn 1: Could you ring Beijing office +86 10 8888 6666? -> Calling the Beijing office at +86 10 8888 6666...', 'turn 2: Can you display the active countdown timers for me? -> Currently running countdowns:\n- 4 minutes remaining: Pasta\n- 20 minutes remaining: Laundry cycle\n- 30 minutes remaining: Workout interval']	Add this number as the Beijing office contact.	Add +86 10 8888 6666 as the Beijing office contact.	{'plan': 'ACTION_INSERT_CONTACT', 'arguments': {'contact_info': {'name': 'Beijing office', 'phone': '+86 10 8888 6666'}}}	dial-942-ACTION_SHOW_TIMERS-1_NR-ACTION_INSERT_CONTACT-1	['ACTION_INSERT_CONTACT', 'ACTION_SET_RINGTONE', 'ACTION_SET_ALARM', 'search_location', 'dial']	1.0	ACTION_INSERT_CONTACT
['turn 1: Could you start a phone call to Sydney HQ at (02) 9374 4000? -> Starting your call to Sydney HQ at (02) 9374 4000...', 'turn 2: Can you pull up the log for the call to Sydney HQ at (02) 9374 4000 and any others? -> I’ve got these entries: Outgoing to (02) 9374 4000 (Sydney HQ) - Today 4:30 PM; Missed call from +61 2 9000 1234 - Today 1:20 PM; Incoming from +61 2 9374 5000 - Yesterday 6:45 PM.']	Save that incoming number as a new contact Field Office	Save +61 2 9374 5000 as a new contact Field Office	{'plan': 'ACTION_INSERT_CONTACT', 'arguments': {'contact_info': {'name': 'Field Office', 'phone': '+61 2 9374 5000'}}}	dial-922-ACTION_VIEW_CALL_LOG-1-ACTION_INSERT_CONTACT-1	['dial', 'ACTION_EDIT_CONTACT', 'ACTION_INSERT_CONTACT', 'ACTION_SHOW_TIMERS', 'ACTION_CREATE_DOCUMENT']		ACTION_INSERT_CONTACT
"['turn 1: Call the reception at extension 7890. -> Placing a call to extension 7890...', ""turn 2: I'd like to see the list of my recent calls. -> Your recent calls include: Outgoing to extension 7890 - Today 10:05 AM; Missed from +1-800-555-0000 - Today 8:15 AM; Incoming from Sarah +1-555-111-2222 - Yesterday 4:50 PM."", ""turn 3: Save Sarah's +1-555-111-2222 number as a new contact -> New contact added: Sarah, +1-555-111-2222. Reference: content://contacts/people/sarah_002.""]"	Save this extension as a contact named Reception.	Save extension 7890 as a contact named Reception.	{'plan': 'ACTION_INSERT_CONTACT', 'arguments': {'contact_info': {'name': 'Reception', 'phone': '7890'}}}	dial-920-ACTION_VIEW_CALL_LOG-1-ACTION_INSERT_CONTACT-1-ACTION_INSERT_CONTACT-1	['ACTION_INSERT_CONTACT', 'ACTION_EDIT_CONTACT', 'search_location', 'ACTION_IMAGE_CAPTURE', 'ACTION_VIEW_CONTACT']	1.0	ACTION_INSERT_CONTACT
"[""turn 1: Call grandma's cell at 555.123.4567. -> Calling grandma’s cell at 555.123.4567..."", 'turn 2: Pull an email from my stored contacts. -> Email picker is up. Email chosen: content://contacts/email/34.', ""turn 3: Set content://contacts/email/34's name to Robert Johnson. -> Contact entry renamed to Robert Johnson. (URI: content://contacts/email/34)"", 'turn 4: Open content://contacts/email/34 to see the details -> Okay, displaying the contact info here: content://contacts/email/34']"	Save this number as Grandma's cell	Save 555.123.4567 as Grandma's cell	"{'plan': 'ACTION_INSERT_CONTACT', 'arguments': {'contact_info': {'name': ""Grandma's cell"", 'phone': '555.123.4567'}}}"	dial-938-ACTION_PICK-1_NR-ACTION_EDIT_CONTACT-1-ACTION_VIEW_CONTACT-1-ACTION_INSERT_CONTACT-1	['ACTION_VIEW_PLAYLIST', 'ACTION_VIEW_CONTACT', 'ACTION_INSERT_CONTACT', 'ACTION_SET_ALARM', 'ACTION_PICK']	1.0	ACTION_INSERT_CONTACT
['turn 1: Start guidance to Tokyo Tower, Tokyo, Japan. -> Tokyo Tower, Tokyo, Japan: guidance has been activated. Enjoy the trip!', 'turn 2: Please provide a summary of the contact details for /contacts/ursula. -> Here’s Ursula’s contact summary:\nName: Ursula Lee\nPhone: +1-303-555-0119\nEmail: ursula.lee@provider.com\nAddress: 321 Elm Street, Boulder, CO 80302', 'turn 3: Place a call to +1-303-555-0119 -> Now dialing +1-303-555-0119...', 'turn 4: Store +1-303-555-0119 in my contacts -> Done! +1-303-555-0119 is now saved. View it anytime at content://contacts/people/3035550119']	Add this number as a new contact	Add +1-303-555-0119 as a new contact	{'plan': 'ACTION_INSERT_CONTACT', 'arguments': {'contact_info': {'phone': '+1-303-555-0119'}}}	ACTION_NAVIGATE_TO_LOCATION-1759-get_contact_info-1_NR-dial-1-ACTION_INSERT_CONTACT-1-ACTION_INSERT_CONTACT-1	['ACTION_OPEN_DOCUMENT', 'ACTION_IMAGE_CAPTURE', 'ACTION_VIEW_CALL_LOG', 'ACTION_INSERT_CONTACT', 'ACTION_NAVIGATE_TO_LOCATION']	3.0	ACTION_INSERT_CONTACT
['turn 1: Could you send a motivational quote to my friend Lisa at 555-987-6543? -> Motivational quote sent to 555-987-6543.', 'turn 2: Ring 555-987-6543 up -> Connecting you to 555-987-6543 now...', 'turn 3: Could you pull up my call log? -> Your recent calls include: 555-987-6543 (Outgoing) – Today 4:40 PM; Gym +1-415-555-6789 (Missed) – Today 7:00 AM; Mom +1-212-555-0001 (Incoming) – Yesterday 9:30 PM']	Save that gym number as a new contact Fitness Center	Save +1-415-555-6789 as a new contact Fitness Center	{'plan': 'ACTION_INSERT_CONTACT', 'arguments': {'contact_info': {'name': 'Fitness Center', 'phone': '+1-415-555-6789'}}}	send_message-1242-dial-1-ACTION_VIEW_CALL_LOG-1-ACTION_INSERT_CONTACT-1	['send_email', 'ACTION_CREATE_DOCUMENT', 'ACTION_INSERT_CONTACT', 'ACTION_VIEW_RECENT_APPS', 'ACTION_VIEW_PLAYLIST']		ACTION_INSERT_CONTACT
"['turn 1: Where is the nearest pharmacy around here? -> Your nearest pharmacy is Green Cross Pharmacy at 123 Main St, just 0.3 miles north of your current location.', ""turn 2: Schedule 'Prescription Pickup' at 123 Main St tomorrow at 10 AM for 30 minutes with description 'Pick up my prescription'. -> Prescription Pickup (Pick up my prescription) has been scheduled tomorrow at 10:00\xa0AM–10:30\xa0AM at 123 Main St. Check it here: content://calendar/event/103""]"	Add an event titled 'Prescription Pickup' there tomorrow at 3pm with description 'Pick up prescription' lasting one hour.	Add an event titled 'Prescription Pickup' at Green Cross Pharmacy at 123 Main St tomorrow at 3pm with description 'Pick up prescription' lasting one hour.	{'plan': 'ACTION_INSERT_EVENT', 'arguments': {'TITLE': 'Prescription Pickup', 'DESCRIPTION': 'Pick up prescription', 'EVENT_LOCATION': 'Green Cross Pharmacy at 123 Main St', 'BEGIN_TIME': 1700600000000, 'END_TIME': 1700603600000}}	search_location-1156-ACTION_INSERT_EVENT-1-ACTION_INSERT_EVENT-1	['ACTION_IMAGE_CAPTURE', 'dial', 'send_email', 'ACTION_INSERT_EVENT', 'ACTION_VIEW_SENT_MESSAGES']	1.0	ACTION_INSERT_EVENT
['turn 1: Can you find Eiffel Tower’s exact GPS? -> Coordinates for the Eiffel Tower: 48.8584° N, 2.2945° E.']	Book a photo session there this Friday at sunset for two hours.	Book a photo session at 48.8584° N, 2.2945° E this Friday at sunset for two hours.	{'plan': 'ACTION_INSERT_EVENT', 'arguments': {'TITLE': 'Photo Session', 'DESCRIPTION': 'Photo session', 'EVENT_LOCATION': '48.8584° N, 2.2945° E', 'BEGIN_TIME': 1683313200000, 'END_TIME': 1683320400000}}	search_location-1177-ACTION_INSERT_EVENT-1	['ACTION_SET_ALARM', 'ACTION_SHOW_TIMERS', 'INTENT_ACTION_VIDEO_CAMERA', 'ACTION_INSERT_EVENT', 'ACTION_CREATE_DOCUMENT']		ACTION_INSERT_EVENT
"[""turn 1: Please transmit 'Password for the vault is 8392' to the security manager at +1-310-555-0111. -> Vault password notification sent securely to +13105550111."", 'turn 2: Show me the active timers list. -> Looks like you don’t have any daily timers active right now.', ""turn 3: I need to book an event called 'Customer Feedback Session' to collect feedback on our new product. It will take place at Client's Office, starting at 1703400000000 and ending at 1703405400000. -> 'Customer Feedback Session' at Client's Office is now on your calendar for 1703400000000–1703405400000. Details: content://calendar/event/105."", ""turn 4: What's the address for Client's Office? -> Client's Office is at 400 Client Plaza, Springfield, IL 62701, USA.""]"	Set up a 'Product Demo' event at that location this Friday from 2 PM to 3 PM for investors.	Set up a 'Product Demo' event at 400 Client Plaza, Springfield, IL 62701, USA this Friday from 2 PM to 3 PM for investors.	{'plan': 'ACTION_INSERT_EVENT', 'arguments': {'TITLE': 'Product Demo', 'DESCRIPTION': 'For investors', 'EVENT_LOCATION': '400 Client Plaza, Springfield, IL 62701, USA', 'BEGIN_TIME': 1704463200000, 'END_TIME': 1704466800000}}	send_message-1295-ACTION_SHOW_TIMERS-1_NR-ACTION_INSERT_EVENT-1_NR-search_location-1-ACTION_INSERT_EVENT-1	['ACTION_PICK', 'ACTION_SHOW_ALARMS', 'play_video', 'ACTION_INSERT_EVENT', 'INTENT_ACTION_STILL_IMAGE_CAMERA']		ACTION_INSERT_EVENT
"['turn 1: Could you find the precise address of the White House? -> Here you go: The White House at 1600 Pennsylvania Avenue NW, Washington, DC 20500, USA.', ""turn 2: Create 'Tour of White House' at 1600 Pennsylvania Avenue NW, Washington, DC 20500, USA on April 15 from 11 AM to 12 PM with description 'Guided tour'. -> Event 'Tour of White House' (Guided tour) set for April 15, 2024 from 11:00\xa0AM to 12:00\xa0PM at 1600 Pennsylvania Avenue NW, Washington, DC 20500, USA. content://calendar/event/106""]"	Add an event titled 'White House Tour' there next Monday at 2pm with description 'Guided tour' lasting two hours.	Add an event titled 'White House Tour' at 1600 Pennsylvania Avenue NW, Washington, DC 20500, USA next Monday at 2pm with description 'Guided tour' lasting two hours.	{'plan': 'ACTION_INSERT_EVENT', 'arguments': {'TITLE': 'White House Tour', 'DESCRIPTION': 'Guided tour', 'EVENT_LOCATION': '1600 Pennsylvania Avenue NW, Washington, DC 20500, USA', 'BEGIN_TIME': 1700700000000, 'END_TIME': 1700710800000}}	search_location-1159-ACTION_INSERT_EVENT-1-ACTION_INSERT_EVENT-1	['ACTION_EDIT_VIDEO', 'ACTION_OPEN_CONTENT', 'ACTION_INSERT_EVENT', 'search_location', 'ACTION_EDIT_ALARM']	1.0	ACTION_INSERT_EVENT
['turn 1: Grab web assets: HTML, CSS and JavaScript files. -> Ready to grab web assets—pick your HTML, CSS, and JS files. Multiple selection is enabled.', 'turn 2: Please look up the address of the contact found at /directory/annie. -> Annie’s address is 456 Oak Avenue, Metropolis, NY 10001.', 'turn 3: Show 456 Oak Avenue, Metropolis, NY 10001 on the map -> All set! 456 Oak Avenue, Metropolis, NY 10001 is now marked on your map.']	Set up a meeting there next Monday at 10 AM titled Project Kickoff, description Initial planning session, lasting one hour.	Set up a meeting at 456 Oak Avenue, Metropolis, NY 10001 next Monday at 10 AM titled Project Kickoff, description Initial planning session, lasting one hour.	{'plan': 'ACTION_INSERT_EVENT', 'arguments': {'TITLE': 'Project Kickoff', 'DESCRIPTION': 'Initial planning session', 'EVENT_LOCATION': '456 Oak Avenue, Metropolis, NY 10001', 'BEGIN_TIME': 1701693600000, 'END_TIME': 1701697200000}}	ACTION_OPEN_DOCUMENT-164-get_contact_info-1_NR-search_location-1-ACTION_INSERT_EVENT-1	['ACTION_INSERT_EVENT', 'get_contact_info_from_uri', 'play_video', 'ACTION_VIDEO_CAPTURE', 'ACTION_PICK']		ACTION_INSERT_EVENT
"[""turn 1: Message my neighbor at +44 7312 345678: 'Could you feed my cat while I'm away?' -> Request sent to your neighbor at +447312345678."", ""turn 2: What messages have I sent? -> Sent messages: +447312345678 – 'Could you feed my cat while I'm away?'."", ""turn 3: I would like to set up an event titled 'Art Exhibition'. It's a public display of local art at Downtown Gallery from 1701100000000 to 1701103600000. -> Great news—‘Art Exhibition’ has been scheduled for November 17 at Downtown Gallery. View it here: content://calendar/event/15"", 'turn 4: Can you show me where Downtown Gallery is located? -> Downtown Gallery is at 45 Art Ave, Springfield, IL 62703.']"	Plan a gallery opening reception there next Wednesday from 5 PM to 7 PM	Plan a gallery opening reception at 45 Art Ave, Springfield, IL 62703 next Wednesday from 5 PM to 7 PM	{'plan': 'ACTION_INSERT_EVENT', 'arguments': {'TITLE': 'Gallery Opening Reception', 'DESCRIPTION': 'Gallery opening reception', 'EVENT_LOCATION': '45 Art Ave, Springfield, IL 62703', 'BEGIN_TIME': 1701968400000, 'END_TIME': 1701975600000}}	send_message-1287-ACTION_VIEW_SENT_MESSAGES-1-ACTION_INSERT_EVENT-1_NR-search_location-1-ACTION_INSERT_EVENT-1	['play_video', 'dial', 'ACTION_VIEW_RECENT_APPS', 'ACTION_GET_CONTENT', 'ACTION_INSERT_EVENT']		ACTION_INSERT_EVENT
['turn 1: I want to change my language preferences. Open language & input settings. -> Language & input settings are now accessible.', 'turn 2: Find language translation services nearby. -> Here’s one: Lingua Services, 210 Language Road, Springfield.']	Set up a Translation Consultation event there on Monday from 2 PM to 3 PM to go over documents	Set up a Translation Consultation event at Lingua Services, 210 Language Road, Springfield on Monday from 2 PM to 3 PM to go over documents	{'plan': 'ACTION_INSERT_EVENT', 'arguments': {'TITLE': 'Translation Consultation', 'DESCRIPTION': 'Go over documents', 'EVENT_LOCATION': 'Lingua Services, 210 Language Road, Springfield', 'BEGIN_TIME': 1700655200000, 'END_TIME': 1700658800000}}	open_settings-1081-search_location-1-ACTION_INSERT_EVENT-1	['ACTION_IMAGE_CAPTURE', 'ACTION_INSERT_EVENT', 'ACTION_GET_CONTENT', 'ACTION_SHOW_ALARMS', 'ACTION_INSERT_CONTACT']		ACTION_INSERT_EVENT
"['turn 1: Can you find where the Great Wall of China is located? -> The Great Wall can be pinpointed around Huairou District: 40.4319°\xa0N, 116.5704°\xa0E, China.', ""turn 2: Lead me to Huairou District: 40.4319°\xa0N, 116.5704°\xa0E, China. -> Guiding you to Huairou District (40.4319° N, 116.5704° E, China). Let's go!"", 'turn 3: Could you please provide a way to select my PDF file? -> Okay, launching the PDF picker. Please select your document.']"	Plan a hike there on May 1st starting at 8 am for five hours titled 'Great Wall Hike' with description 'Hiking session along the Great Wall'.	Plan a hike at 40.4319° N, 116.5704° E, Huairou District, China on May 1st starting at 8 am for five hours titled 'Great Wall Hike' with description 'Hiking session along the Great Wall'.	{'plan': 'ACTION_INSERT_EVENT', 'arguments': {'TITLE': 'Great Wall Hike', 'DESCRIPTION': 'Hiking session along the Great Wall', 'EVENT_LOCATION': '40.4319° N, 116.5704° E, Huairou District, China', 'BEGIN_TIME': 1710300000000, 'END_TIME': 1710318000000}}	search_location-1139-ACTION_NAVIGATE_TO_LOCATION-1-ACTION_OPEN_DOCUMENT-1_NR-ACTION_INSERT_EVENT-1	['INTENT_ACTION_VIDEO_CAMERA', 'ACTION_INSERT_EVENT', 'ACTION_VIEW_SENT_EMAILS', 'ACTION_SET_ALARM', 'ACTION_SET_TIMER']	1.0	ACTION_INSERT_EVENT
['turn 1: Show me where Mount Kilimanjaro stands. -> Mount Kilimanjaro is at 3.0674°\xa0S, 37.3556°\xa0E—displaying it on your map now.']	Set up a 'Kilimanjaro Hike' event there this Friday from 6:00 to 9:00.	Set up a 'Kilimanjaro Hike' event at 3.0674° S, 37.3556° E this Friday from 6:00 to 9:00.	{'plan': 'ACTION_INSERT_EVENT', 'arguments': {'TITLE': 'Kilimanjaro Hike', 'DESCRIPTION': 'Kilimanjaro hike', 'EVENT_LOCATION': '3.0674° S, 37.3556° E', 'BEGIN_TIME': 1683266400000, 'END_TIME': 1683277200000}}	search_location-1162-ACTION_INSERT_EVENT-1	['ACTION_EDIT_CONTACT', 'ACTION_INSERT_EVENT', 'ACTION_OPEN_CONTENT', 'get_contact_info', 'ACTION_VIEW_PLAYLIST']		ACTION_INSERT_EVENT
"[""turn 1: Set up 'Gardening Meetup' June 8, 2024 at 10 AM to 12 PM at Community Garden, details: Planting season prep. -> Gardening Meetup (Planting season prep) scheduled for June\xa08,\xa02024 from 10:00\xa0AM to 12:00\xa0PM at Community Garden. Event URI: content://calendar/event/10"", ""turn 2: Please arrange a 'Coding Workshop' focused on Python at Tech Hub. The event is scheduled to run from 1700900000000 to 1700907200000. -> Your 'Coding Workshop' (Learning session focused on Python) is confirmed at Tech Hub from 1700900000000 to 1700907200000. Event URI: content://calendar/event/7"", 'turn 3: What’s the address for Community Garden? -> I’ve got Community Garden here: 256 Greenway Lane, Springfield, IL 62704.']"	Schedule a planting session there this Saturday from 9 AM to 11 AM titled 'Seed Starting' with description 'Begin seeds for community garden'.	Schedule a planting session at 256 Greenway Lane, Springfield, IL 62704 this Saturday from 9 AM to 11 AM titled 'Seed Starting' with description 'Begin seeds for community garden'.	{'plan': 'ACTION_INSERT_EVENT', 'arguments': {'TITLE': 'Seed Starting', 'DESCRIPTION': 'Begin seeds for community garden', 'EVENT_LOCATION': '256 Greenway Lane, Springfield, IL 62704', 'BEGIN_TIME': 1701517200000, 'END_TIME': 1701524400000}}	ACTION_INSERT_EVENT-485-ACTION_INSERT_EVENT-1_NR-search_location-1-ACTION_INSERT_EVENT-1	['INTENT_ACTION_VIDEO_CAMERA', 'ACTION_SHOW_TIMERS', 'ACTION_OPEN_CONTENT', 'ACTION_INSERT_EVENT', 'ACTION_NAVIGATE_TO_LOCATION']		ACTION_INSERT_EVENT
['turn 1: Start guidance to Tokyo Tower, Tokyo, Japan. -> Tokyo Tower, Tokyo, Japan: guidance has been activated. Enjoy the trip!', 'turn 2: Please provide a summary of the contact details for /contacts/ursula. -> Here’s Ursula’s contact summary:\nName: Ursula Lee\nPhone: +1-303-555-0119\nEmail: ursula.lee@provider.com\nAddress: 321 Elm Street, Boulder, CO 80302', 'turn 3: Open /contacts/ursula to see all details. -> Retrieving all details for /contacts/ursula now.']	Navigate to that address.	Navigate to 321 Elm Street, Boulder, CO 80302.	{'plan': 'ACTION_NAVIGATE_TO_LOCATION', 'arguments': {'location': '321 Elm Street, Boulder, CO 80302'}}	ACTION_NAVIGATE_TO_LOCATION-1759-get_contact_info-1_NR-ACTION_VIEW_CONTACT-1-ACTION_NAVIGATE_TO_LOCATION-1	['send_email', 'ACTION_NAVIGATE_TO_LOCATION', 'ACTION_VIEW_CALL_LOG', 'ACTION_VIEW_SENT_EMAILS', 'ACTION_SET_ALARM']	2.0	ACTION_NAVIGATE_TO_LOCATION
"['turn 1: Could you bring forward my recently opened apps? -> Your recent apps are: Chrome; YouTube; Docs; Sheets', 'turn 2: I am interested in seeing the timers that are currently on. -> Active timers list: [5 minutes – Stretch break, 25 minutes – Focus session, 3 minutes – Email check]', ""turn 3: I would like to add an event called 'Sculpture Workshop'. The description is 'Learn sculpting basics under expert guidance'. It will be hosted at the Art Institute from 1702500000000 to 1702505400000. -> Done – 'Sculpture Workshop' has been added on December 14 at Art Institute. Check it out: content://calendar/event/4"", ""turn 4: Bring up content://calendar/event/4's full schedule. -> Your 'Sculpture Workshop' is set for December 14 at Art Institute. Description: Learn sculpting basics under expert guidance.""]"	Navigate there	Navigate to Art Institute	{'plan': 'ACTION_NAVIGATE_TO_LOCATION', 'arguments': {'location': 'Art Institute'}}	ACTION_VIEW_RECENT_APPS-2209-ACTION_SHOW_TIMERS-1_NR-ACTION_INSERT_EVENT-1_NR-ACTION_VIEW_EVENT-1-ACTION_NAVIGATE_TO_LOCATION-1	['ACTION_PICK', 'ACTION_SET_TIMER', 'ACTION_NAVIGATE_TO_LOCATION', 'ACTION_VIEW_SENT_EMAILS', 'get_contact_info_from_uri']	3.0	ACTION_NAVIGATE_TO_LOCATION
"['turn 1: Access ringtone options for my evening alarm. -> Accessing ringtone options for your evening alarm now.', 'turn 2: Please retrieve the address from the contact record at /user/info/hello_world. -> The address stored at /user/info/hello_world is 99 Infinite Loop, Imaginary City, ZX 12345.', ""turn 3: I'm looking for someone’s mailing address in my contact list. -> Here’s the address you requested: content://contacts/address/16"", 'turn 4: Change content://contacts/address/16 address to 221B Baker Street, London -> Your update is complete: content://contacts/address/16 now has 221B Baker Street, London as its address.']"	Plot a route to that location.	Plot a route to content://contacts/address/16 location.	{'plan': 'ACTION_NAVIGATE_TO_LOCATION', 'arguments': {'location': 'content://contacts/address/16'}}	ACTION_GET_RINGTONE-323-get_contact_info-1_NR-ACTION_PICK-1_NR-ACTION_EDIT_CONTACT-1-ACTION_NAVIGATE_TO_LOCATION-1	['ACTION_OPEN_DOCUMENT', 'ACTION_NAVIGATE_TO_LOCATION', 'open_settings', 'ACTION_INSERT_EVENT', 'ACTION_OPEN_CONTENT']	2.0	ACTION_NAVIGATE_TO_LOCATION
['turn 1: Show me where Mount Kilimanjaro stands. -> Mount Kilimanjaro is at 3.0674°\xa0S, 37.3556°\xa0E—displaying it on your map now.', 'turn 2: I need to adjust the clock on my device. Open the date and time settings, please. -> Date & Time settings opened. Set your clock as you wish.']	Give me directions there.	Give me directions to 3.0674° S, 37.3556° E.	{'plan': 'ACTION_NAVIGATE_TO_LOCATION', 'arguments': {'location': '3.0674° S, 37.3556° E'}}	search_location-1162-open_settings-1_NR-ACTION_NAVIGATE_TO_LOCATION-1	['play_music', 'ACTION_NAVIGATE_TO_LOCATION', 'ACTION_SHOW_ALARMS', 'ACTION_SET_RINGTONE', 'play_video']	1.0	ACTION_NAVIGATE_TO_LOCATION
"['turn 1: Open the memory card options, please. -> Memory card settings opened — you can now manage your external storage.', 'turn 2: Find the nearest gas station -> Sure thing. The nearest gas station is Shell, 842 Elm Street, Springfield.', ""turn 3: Create an event called Fill Up at Shell, 842 Elm Street, Springfield tomorrow at 3 PM and ending at 3:30 PM with description Fill the tank -> Sure—I've added 'Fill Up at Shell' to your calendar for tomorrow from 3:00 PM to 3:30 PM at 842 Elm Street, Springfield. You can view it here: content://calendar/event/1"", 'turn 4: Can you show me where 842 Elm Street, Springfield is on the map? -> Centering map on 842 Elm Street, Springfield. Here’s the location.']"	Route me to that address	Route me to 842 Elm Street, Springfield	{'plan': 'ACTION_NAVIGATE_TO_LOCATION', 'arguments': {'location': '842 Elm Street, Springfield'}}	open_settings-1088-search_location-1-ACTION_INSERT_EVENT-1-search_location-1-ACTION_NAVIGATE_TO_LOCATION-1	['ACTION_NAVIGATE_TO_LOCATION', 'send_email', 'get_contact_info', 'ACTION_EDIT_ALARM', 'ACTION_PICK']	3.0	ACTION_NAVIGATE_TO_LOCATION
"['turn 1: Could you search for the location of the Acropolis in Athens, Greece? -> Sure thing! The Acropolis is located at ""Acropolis, Athens 105 58, Greece.""', ""turn 2: Create an event at Acropolis, Athens 105 58, Greece on July 10 from 9 AM to 11 AM titled Project Review with description Discuss quarterly goals -> Your event 'Project Review' has been added to July 10, 2023, 9:00 AM–11:00 AM at Acropolis, Athens 105\xa058, Greece. content://calendar/event/201""]"	Start navigation to that destination.	Start navigation to Acropolis, Athens 105 58, Greece.	{'plan': 'ACTION_NAVIGATE_TO_LOCATION', 'arguments': {'location': 'Acropolis, Athens 105 58, Greece'}}	search_location-1131-ACTION_INSERT_EVENT-1-ACTION_NAVIGATE_TO_LOCATION-1	['ACTION_EDIT_VIDEO', 'ACTION_SET_ALARM', 'ACTION_NAVIGATE_TO_LOCATION', 'INTENT_ACTION_STILL_IMAGE_CAMERA', 'ACTION_PICK']	1.0	ACTION_NAVIGATE_TO_LOCATION
