conversation_history	query	rewrited_query	answer	unique_idx	candidates	refered_turn	plan
"[""turn 1: I'd like to upload any type of file for a quick backup. -> Your file has been selected for backup: content://files/backup_archive.zip"", 'turn 2: Save content://files/backup_archive.zip as a new ZIP file named FullBackup.zip -> Backup complete: you can find FullBackup.zip here: content://documents/FullBackup.zip', 'turn 3: Edit content://documents/FullBackup.zip to add a README file describing its contents -> Your backup archive has been updated with a README describing its contents. Access the revised FullBackup.zip here: content://documents/FullBackup.zip', ""turn 4: Could you pick a contact for me from my records? -> I've selected a contact for you: content://contacts/people/15""]"	Create a new document for that archive with MIME type application/zip and initial name BackupArchive.zip	Create a new document for content://documents/FullBackup.zip with MIME type application/zip and initial name BackupArchive.zip	{'plan': 'ACTION_CREATE_DOCUMENT', 'arguments': {'mime_type': 'application/zip', 'initial_name': 'BackupArchive.zip'}}	ACTION_GET_CONTENT-170-ACTION_CREATE_DOCUMENT-1-ACTION_EDIT_DOCUMENT-1-ACTION_PICK-1_NR-ACTION_CREATE_DOCUMENT-1	['play_video', 'ACTION_VIEW_WEB_HISTORY', 'ACTION_CREATE_DOCUMENT', 'search_location', 'ACTION_GET_CONTENT']	1.0	ACTION_CREATE_DOCUMENT
['turn 1: Could I choose a few AVI videos to compile into a highlight reel? -> Go ahead and select multiple AVI videos for your highlight reel.']	Create a new one named HighlightReel.avi.	Create a new highlight reel named HighlightReel.avi.	{'plan': 'ACTION_CREATE_DOCUMENT', 'arguments': {'mime_type': 'video/x-msvideo', 'initial_name': 'HighlightReel.avi'}}	ACTION_GET_CONTENT-187-ACTION_CREATE_DOCUMENT-1	['ACTION_CREATE_DOCUMENT', 'INTENT_ACTION_STILL_IMAGE_CAMERA', 'ACTION_VIEW_CONTACT', 'ACTION_VIEW_EVENT', 'launch_application']		ACTION_CREATE_DOCUMENT
"['turn 1: Fetch multiple Excel spreadsheets from your local storage. -> Fetched the requested spreadsheets:\n• content://spreadsheets/budget_report.xls\n• content://spreadsheets/sales_data.xls', 'turn 2: Create a new Excel spreadsheet named ConsolidatedData.xls -> Just finished your Excel file. ConsolidatedData.xls is available at content://documents/ConsolidatedData.xls', ""turn 3: Edit content://documents/ConsolidatedData.xls to add headers 'Date, Item, Amount' in the first row -> Headers 'Date, Item, Amount' have been inserted into the first row of ConsolidatedData.xls. Check it here: content://documents/ConsolidatedData.xls""]"	Create a new Excel file named ConsolidatedReport.xls to merge those spreadsheets.	Create a new Excel file named ConsolidatedReport.xls to merge the spreadsheets content://spreadsheets/budget_report.xls and content://spreadsheets/sales_data.xls.	{'plan': 'ACTION_CREATE_DOCUMENT', 'arguments': {'mime_type': 'application/vnd.ms-excel', 'initial_name': 'ConsolidatedReport.xls'}}	ACTION_GET_CONTENT-173-ACTION_CREATE_DOCUMENT-1-ACTION_EDIT_DOCUMENT-1-ACTION_CREATE_DOCUMENT-1	['INTENT_ACTION_VIDEO_CAMERA', 'ACTION_EDIT_DOCUMENT', 'ACTION_VIEW_CALL_LOG', 'ACTION_CREATE_DOCUMENT', 'ACTION_EDIT_CONTACT']	1.0	ACTION_CREATE_DOCUMENT
"['turn 1: Select multiple images to include in a photo collage. -> Here are the images you picked for the collage:\n- content://gallery/holiday1.jpg\n- content://gallery/holiday2.jpg\n- content://gallery/holiday3.jpg\n- content://gallery/holiday4.jpg', 'turn 2: Create a new PDF document called HolidayCollage.pdf -> Your holiday collage is all set! PDF created at content://documents/HolidayCollage.pdf', 'turn 3: Edit content://documents/HolidayCollage.pdf to add captions under each image -> Captions added under each image in HolidayCollage.pdf. You can view the updated PDF at content://documents/HolidayCollage.pdf', ""turn 4: I'm planning to capture some video. Please start the video camera application. -> Video camera app launched successfully. You can begin your capture now.""]"	Create a new PDF document named HolidayCollage.pdf for those images.	Create a new PDF document named HolidayCollage.pdf for content://gallery/holiday1.jpg, content://gallery/holiday2.jpg, content://gallery/holiday3.jpg, and content://gallery/holiday4.jpg.	{'plan': 'ACTION_CREATE_DOCUMENT', 'arguments': {'mime_type': 'application/pdf', 'initial_name': 'HolidayCollage.pdf'}}	ACTION_GET_CONTENT-171-ACTION_CREATE_DOCUMENT-1-ACTION_EDIT_DOCUMENT-1-INTENT_ACTION_VIDEO_CAMERA-1_NR-ACTION_CREATE_DOCUMENT-1	['ACTION_GET_CONTENT', 'search_location', 'ACTION_VIEW_SENT_EMAILS', 'ACTION_OPEN_CONTENT', 'ACTION_CREATE_DOCUMENT']	1.0	ACTION_CREATE_DOCUMENT
"['turn 1: Please choose an Excel file to view the data. -> Please select a single Excel (.xls) file to view its data.', 'turn 2: Go ahead and create DataView.xls -> Alright, setting up a new Excel workbook. Pick a location to save “DataView.xls.”', ""turn 3: Trigger the device's still image camera app for a photo capture. -> Device's camera is open in still image mode. You can take a photo now.""]"	Make a new one named Summary.xls	Make a new Excel file named Summary.xls	{'plan': 'ACTION_CREATE_DOCUMENT', 'arguments': {'mime_type': 'application/vnd.ms-excel', 'initial_name': 'Summary.xls'}}	ACTION_GET_CONTENT-203-ACTION_CREATE_DOCUMENT-1-INTENT_ACTION_STILL_IMAGE_CAMERA-1_NR-ACTION_CREATE_DOCUMENT-1	['ACTION_SET_RINGTONE', 'ACTION_VIEW_EVENT', 'ACTION_OPEN_CONTENT', 'ACTION_INSERT_CONTACT', 'ACTION_CREATE_DOCUMENT']	1.0	ACTION_CREATE_DOCUMENT
"['turn 1: Launch Bluetooth settings so I can connect to my headset. -> Bluetooth settings are open and ready for you to connect your headset.', 'turn 2: Open the file chooser for image documents, and allow me to pick multiple files if necessary. -> Image chooser launched—your picks:\n1) content://images/vacation1.jpg\n2) content://images/vacation2.png', ""turn 3: Text content://images/vacation1.jpg and content://images/vacation2.png to Emma with the message 'Thought you'd like these photos.' -> Photos delivered to Emma. She should get them shortly."", 'turn 4: Show me the messages I just sent -> Sent messages: Emma – ""Thought you\'d like these photos.""']"	Create a new PDF for these images named VacationAlbum.pdf	Create a new PDF for content://images/vacation1.jpg and content://images/vacation2.png named VacationAlbum.pdf	{'plan': 'ACTION_CREATE_DOCUMENT', 'arguments': {'mime_type': 'application/pdf', 'initial_name': 'VacationAlbum.pdf'}}	open_settings-1097-ACTION_OPEN_DOCUMENT-1_NR-send_message-1-ACTION_VIEW_SENT_MESSAGES-1-ACTION_CREATE_DOCUMENT-1	['get_contact_info', 'ACTION_IMAGE_CAPTURE', 'ACTION_CREATE_DOCUMENT', 'ACTION_VIEW_SENT_EMAILS', 'ACTION_SET_TIMER']	2.0	ACTION_CREATE_DOCUMENT
['turn 1: Open the video recorder. -> Video camera launched successfully.', 'turn 2: Select a video video camera launched successfully just captured. -> Here’s the video you picked: content://temp/video_captured.mp4', 'turn 3: Trim content://temp/video_captured.mp4 to the first 15 seconds -> Trim completed! The first 15 seconds are now available at content://temp/video_captured_first15.mp4.', 'turn 4: Play content://temp/video_captured_first15.mp4. -> Starting playback of content://temp/video_captured_first15.mp4 now.']	Save that video in a new document named RecordedVideo.mp4	Save content://temp/video_captured_first15.mp4 in a new document named RecordedVideo.mp4	{'plan': 'ACTION_CREATE_DOCUMENT', 'arguments': {'mime_type': 'video/mp4', 'initial_name': 'RecordedVideo.mp4'}}	INTENT_ACTION_VIDEO_CAMERA-863-ACTION_GET_CONTENT-1-ACTION_EDIT_VIDEO-1-play_video-1-ACTION_CREATE_DOCUMENT-1	['ACTION_CREATE_DOCUMENT', 'send_message', 'ACTION_VIEW_RECENT_APPS', 'ACTION_EDIT_VIDEO', 'get_contact_info_from_uri']	2.0	ACTION_CREATE_DOCUMENT
"['turn 1: Can you take me to Uluru, Northern Territory, Australia? -> Route to Uluru, Northern Territory, Australia has been started in Maps.', ""turn 2: Access the still image capture app now. -> Still image capture app opened—you're all set to take photos."", 'turn 3: Pick that newest picture -> Here’s the newest picture you grabbed: content://temp/newest_pic.jpg', 'turn 4: Save content://temp/newest_pic.jpg as NewestPicture.jpg -> NewestPicture.jpg has been saved to content://pictures/NewestPicture.jpg.']"	Create a new text document named PicNotes.txt for that newest picture	Create a new text document named PicNotes.txt for content://pictures/NewestPicture.jpg	{'plan': 'ACTION_CREATE_DOCUMENT', 'arguments': {'mime_type': 'text/plain', 'initial_name': 'PicNotes.txt'}}	ACTION_NAVIGATE_TO_LOCATION-1756-INTENT_ACTION_STILL_IMAGE_CAMERA-1_NR-ACTION_GET_CONTENT-1-ACTION_CREATE_DOCUMENT-1-ACTION_CREATE_DOCUMENT-1	['ACTION_VIEW_RECENT_APPS', 'ACTION_SHOW_ALARMS', 'ACTION_GET_RINGTONE', 'ACTION_SHOW_TIMERS', 'ACTION_CREATE_DOCUMENT']	3.0	ACTION_CREATE_DOCUMENT
['turn 1: Pick a single audio track for the presentation. -> Alright—please choose one audio file for your presentation.']	Create a new one named BackgroundMusic.mp3	Create a new audio file named BackgroundMusic.mp3	{'plan': 'ACTION_CREATE_DOCUMENT', 'arguments': {'mime_type': 'audio/mpeg', 'initial_name': 'BackgroundMusic.mp3'}}	ACTION_GET_CONTENT-208-ACTION_CREATE_DOCUMENT-1	['ACTION_CREATE_DOCUMENT', 'ACTION_SET_TIMER', 'ACTION_SHOW_TIMERS', 'ACTION_NAVIGATE_TO_LOCATION', 'ACTION_VIEW_PLAYLIST']		ACTION_CREATE_DOCUMENT
['turn 1: Cut content://tutorials/design.mp4 so that it ends at 2:30. -> All done! design.mp4 now finishes at 2:30. Here’s your trimmed file: content://media/edited_video_002.mp4. Would you like to preview it?', 'turn 2: Turn on the camera app to capture a still image. -> Camera app in still-photo mode is now active.', 'turn 3: Pick the latest shot from the camera. -> Here’s your latest camera capture: content://temp/camera_last.jpg']	Create a new image file named Snapshot.jpg for it	Create a new image file named Snapshot.jpg for content://temp/camera_last.jpg	{'plan': 'ACTION_CREATE_DOCUMENT', 'arguments': {'mime_type': 'image/jpeg', 'initial_name': 'Snapshot.jpg'}}	ACTION_EDIT_VIDEO-1727-INTENT_ACTION_STILL_IMAGE_CAMERA-1_NR-ACTION_GET_CONTENT-1-ACTION_CREATE_DOCUMENT-1	['web_search', 'INTENT_ACTION_STILL_IMAGE_CAMERA', 'ACTION_CREATE_DOCUMENT', 'send_email', 'ACTION_EDIT_ALARM']		ACTION_CREATE_DOCUMENT
"['turn 1: Show me all my alarms. -> Current alarms: [alarm_id: 1 - 6:30 AM, Morning Yoga; alarm_id: 2 - 12:00 PM, Lunch Reminder; alarm_id: 3 - 9:00 PM, Take Medication]', ""turn 2: Add one for 7:45 AM named Check Emails repeating weekdays without vibration. -> Alarm (alarm_id: alarm_206) set for weekdays at 7:45 AM: 'Check Emails' (vibration off)."", 'turn 3: What alarms are there? -> Right now you’ve got these alarms: [alarm_id: 1 - 6:30 AM, Morning Yoga; alarm_id: 2 - 12:00 PM, Lunch Reminder; alarm_id: 3 - 9:00 PM, Take Medication; alarm_id: alarm_206 - 7:45 AM, Check Emails (Mon–Fri, vibration off)].']"	Keep that alarm at 7:45 AM but enable vibration and skip the confirmation UI.	Keep alarm_206 at 7:45 AM but enable vibration and skip the confirmation UI.	{'plan': 'ACTION_EDIT_ALARM', 'arguments': {'alarm_id': 206, 'EXTRA_HOUR': 7, 'EXTRA_MINUTES': 45, 'EXTRA_VIBRATE': True, 'EXTRA_SKIP_UI': True}}	ACTION_SHOW_ALARMS-654-ACTION_SET_ALARM-1-ACTION_SHOW_ALARMS-1-ACTION_EDIT_ALARM-1	['web_search', 'ACTION_SET_TIMER', 'launch_application', 'ACTION_EDIT_ALARM', 'get_contact_info_from_uri']	2.0	ACTION_EDIT_ALARM
"[""turn 1: Edit alarm 31 to 13:13, label 'Lunchtime', weekdays only, no vibration, ringtone uri://lunch_jingle, and do it without the UI. -> Alarm 31 updated to 1:13\xa0PM, labeled “Lunchtime,” repeating Monday through Friday, vibration off, playing Lunch Jingle—set without UI."", 'turn 2: List every alarm including Alarm 31. -> All set alarms: [alarm_id: 24 – 10:10\xa0PM Sat (no vibration), alarm_id: 26 – 4:35\xa0PM Wed (pop_tune), alarm_id: 27 – 8:05\xa0AM Mon–Wed (Gentle Bell), alarm_id: 28 – 10:10\xa0AM “Meeting” (Office Bell), alarm_id: 29 – 3:15\xa0PM “Pick up kids” (Kids Tune), alarm_id: 30 – 6:50\xa0AM Sat, alarm_id: 31 – 1:13\xa0PM Mon–Fri “Lunchtime” (Lunch Jingle; no vib), alarm_id: 37 – 9:09\xa0AM (classic; vibrate), alarm_id: 38 – 9:21\xa0PM Mon/Wed/Fri “Study” (study_track), alarm_id: 40 – 10:10\xa0AM daily]']"	Modify it to 12:00 PM Monday through Friday, label it 'Lunch Break', keep the Lunch Jingle ringtone, and confirm through the UI.	Modify 'alarm_id: 31 – 1:13 PM Mon–Fri “Lunchtime” (Lunch Jingle; no vib)' to 12:00 PM Monday through Friday, label it 'Lunch Break', keep the Lunch Jingle ringtone, and confirm through the UI.	{'plan': 'ACTION_EDIT_ALARM', 'arguments': {'alarm_id': 31, 'EXTRA_HOUR': 12, 'EXTRA_MINUTES': 0, 'EXTRA_MESSAGE': 'Lunch Break', 'EXTRA_DAYS': ['Monday', 'Tuesday', 'Wednesday', 'Thursday', 'Friday'], 'EXTRA_RINGTONE': 'Lunch Jingle', 'EXTRA_SKIP_UI': False}}	ACTION_EDIT_ALARM-1665-ACTION_SHOW_ALARMS-1-ACTION_EDIT_ALARM-1	['dial', 'launch_application', 'ACTION_EDIT_ALARM', 'ACTION_PICK', 'ACTION_NAVIGATE_TO_LOCATION']		ACTION_EDIT_ALARM
['turn 1: Set alarm for 7 AM with the ringtone uri://alarm_sound_1. -> Alarm alarm_no7 is set for 7:00 AM using your custom ringtone (uri://alarm_sound_1).', 'turn 2: Can you show me the alarms I have set? -> Active alarms: [alarm_no7 – 7:00 AM daily, custom ringtone at uri://alarm_sound_1].', 'turn 3: Change alarm_no7 to a one-time alarm at 8:00 AM tomorrow and disable vibration. -> Updated! Alarm (alarm_id: 7) is now a one‑time alert for 8:00 AM tomorrow with vibration disabled.', 'turn 4: Please show me my alarms. -> Sure thing! You have the following alarm set: [alarm_id: 7 - 8:00 AM tomorrow, one‑time alert with vibration disabled].']	Change that alarm to 6:45 AM on weekdays with the default ringtone and label it 'Weekday rise'.	Change alarm_id: 7 to 6:45 AM on weekdays with the default ringtone and label it 'Weekday rise'.	{'plan': 'ACTION_EDIT_ALARM', 'arguments': {'alarm_id': 7, 'EXTRA_HOUR': 6, 'EXTRA_MINUTES': 45, 'EXTRA_MESSAGE': 'Weekday rise', 'EXTRA_DAYS': ['Monday', 'Tuesday', 'Wednesday', 'Thursday', 'Friday']}}	ACTION_SET_ALARM-550-ACTION_SHOW_ALARMS-1-ACTION_EDIT_ALARM-1-ACTION_SHOW_ALARMS-1-ACTION_EDIT_ALARM-1	['ACTION_INSERT_CONTACT', 'ACTION_EDIT_ALARM', 'dial', 'INTENT_ACTION_VIDEO_CAMERA', 'send_email']	1.0	ACTION_EDIT_ALARM
"['turn 1: Timer for 20 seconds, message quick exercise. -> Timer set for 20 seconds: quick exercise.', ""turn 2: Could you open content://reports/monthly to edit it? I want to add 'Update for March' before starting. -> Monthly report is open in the editor with ‘Update for March’ inserted at the top. Access it here: content://reports/monthly."", ""turn 3: Set an alarm for 11:30 AM with the note 'Meeting Reminder'. -> Meeting Reminder alert created (alarm_303) for 11:30\xa0AM."", 'turn 4: Actually, have alarm_303 go off at 12:00 PM only on Wednesdays and Fridays. -> Your alarm (alarm_303) has been updated to 12:00 PM on Wednesdays and Fridays.']"	Actually, rename it to 'Project Meeting' and have it repeat every Friday at 11:30 AM	Actually, rename alarm_303 to 'Project Meeting' and have alarm_303 repeat every Friday at 11:30 AM	{'plan': 'ACTION_EDIT_ALARM', 'arguments': {'alarm_id': 303, 'EXTRA_HOUR': 11, 'EXTRA_MINUTES': 30, 'EXTRA_MESSAGE': 'Project Meeting', 'EXTRA_DAYS': ['Friday']}}	ACTION_SET_TIMER-608-ACTION_EDIT_DOCUMENT-1_NR-ACTION_SET_ALARM-1_NR-ACTION_EDIT_ALARM-1-ACTION_EDIT_ALARM-1	['ACTION_EDIT_ALARM', 'play_video', 'open_settings', 'play_music', 'ACTION_OPEN_DOCUMENT']	3.0	ACTION_EDIT_ALARM
"[""turn 1: Disable vibration and set a daily meditation reminder at 9 PM. -> Your daily 'Meditation' reminder (ID: alarm_no5) is set for 9:00 PM with vibration turned off."", ""turn 2: What alarms do I have set right now? -> Your alarms: [alarm_no5 – 9:00 PM daily, 'Meditation' (vibration off)]."", ""turn 3: Create one for 7:00 AM tomorrow labeled 'Morning meditation' using alarm_no5 ringtone -> Sure—I've created alarm_no13 for 'Morning meditation' at 7:00 AM tomorrow, using the ringtone from alarm_no5.""]"	Actually, make that meditation reminder ring at 9:30 PM and turn vibration on.	Change alarm_no5 to 9:30 PM with vibration enabled.	{'plan': 'ACTION_EDIT_ALARM', 'arguments': {'alarm_id': 5, 'EXTRA_HOUR': 21, 'EXTRA_MINUTES': 30, 'EXTRA_VIBRATE': True}}	ACTION_SET_ALARM-548-ACTION_SHOW_ALARMS-1-ACTION_SET_ALARM-1-ACTION_EDIT_ALARM-1	['open_settings', 'ACTION_VIEW_SENT_MESSAGES', 'web_search', 'ACTION_EDIT_ALARM', 'INTENT_ACTION_STILL_IMAGE_CAMERA']	1.0	ACTION_EDIT_ALARM
['turn 1: Adjust alarm 3 to ring at 12:00 noon. -> Alarm 3 is now set to go off at 12:00\xa0PM.', 'turn 2: Show me every alarm I currently have. -> All set alarms: [alarm_id: 1 - 6:15 AM, Daily; alarm_id: 2 - 7:45 AM, Weekdays; alarm_id: 3 - 12:00 PM, Daily]']	Move that 12:00 PM alarm to 1:00 PM and skip the confirmation screen.	Move alarm_id: 3 - 12:00 PM, Daily to 1:00 PM and skip the confirmation screen.	{'plan': 'ACTION_EDIT_ALARM', 'arguments': {'alarm_id': 3, 'EXTRA_HOUR': 13, 'EXTRA_MINUTES': 0, 'EXTRA_DAYS': ['Monday', 'Tuesday', 'Wednesday', 'Thursday', 'Friday', 'Saturday', 'Sunday'], 'EXTRA_SKIP_UI': True}}	ACTION_EDIT_ALARM-1639-ACTION_SHOW_ALARMS-1-ACTION_EDIT_ALARM-1	['ACTION_VIEW_CONTACT', 'ACTION_VIEW_WEB_HISTORY', 'dial', 'ACTION_EDIT_ALARM', 'open_settings']		ACTION_EDIT_ALARM
['turn 1: Create an alarm for 9:20 on Wednesdays, Thursdays and Fridays. -> Alarm set for alarm_id: alarm_no4 - 9:20 AM, repeats on Wednesday, Thursday, Friday.', 'turn 2: Show what alarms I have. -> Here’s a summary of your alarms: [alarm_id: alarm_no4 - 9:20 AM (Wed, Thu, Fri)]', 'turn 3: Change alarm_id: alarm_no4 - 9:20 AM (Wed, Thu, Fri) to 8:00 AM on Wednesday and Friday -> Done! Alarm alarm_no4 has been updated to 8:00 AM on Wednesdays and Fridays.']	Actually, switch that alarm to 9:15 AM and name it 'Team Sync'.	Change alarm_no4 to 9:15 AM with label 'Team Sync'.	{'plan': 'ACTION_EDIT_ALARM', 'arguments': {'alarm_id': 4, 'EXTRA_HOUR': 9, 'EXTRA_MINUTES': 15, 'EXTRA_MESSAGE': 'Team Sync'}}	ACTION_SET_ALARM-577-ACTION_SHOW_ALARMS-1-ACTION_EDIT_ALARM-1-ACTION_EDIT_ALARM-1	['ACTION_SHOW_ALARMS', 'ACTION_EDIT_ALARM', 'ACTION_SET_ALARM', 'ACTION_IMAGE_CAPTURE', 'ACTION_GET_CONTENT']	1.0	ACTION_EDIT_ALARM
"['turn 1: Put an alarm at midnight to mark the new day. -> All set! Alarm (ID: alarm_no2) is scheduled for 12:00 AM: Mark new day.', 'turn 2: I want to use the document picker to select a PDF for some editing tasks. -> Opening the PDF document picker now. Please choose a file to edit.', ""turn 3: If no PDF is found, create one named NewDraft.pdf. -> All set! New PDF 'NewDraft.pdf' has been created at content://documents/NewDraft.pdf. Let me know when you'd like to edit it.""]"	Change that alarm to 1:00 AM and rename it to 'New Day Alarm'.	Change alarm_no2 to 1:00 AM with label 'New Day Alarm'	{'plan': 'ACTION_EDIT_ALARM', 'arguments': {'alarm_id': 2, 'EXTRA_HOUR': 1, 'EXTRA_MINUTES': 0, 'EXTRA_MESSAGE': 'New Day Alarm'}}	ACTION_SET_ALARM-555-ACTION_OPEN_DOCUMENT-1_NR-ACTION_CREATE_DOCUMENT-1-ACTION_EDIT_ALARM-1	['web_search', 'ACTION_CREATE_DOCUMENT', 'ACTION_EDIT_ALARM', 'ACTION_SET_TIMER', 'ACTION_GET_RINGTONE']	1.0	ACTION_EDIT_ALARM
"[""turn 1: Create a 6:45 AM alarm labeled 'Morning workout' without confirmation UI. -> Your 'Morning workout' alarm (ID: alarm_no9) is locked in for 6:45 AM—no confirmation screen required."", ""turn 2: Please display my current alarms. -> Present alarms: [alarm_no9 – 6:45 AM daily, 'Morning workout' (no confirmation)]."", ""turn 3: Change 'alarm_no9 – 6:45 AM daily, 'Morning workout' (no confirmation)]' to 7:00 AM daily, rename it 'Morning run', and show the confirmation screen. -> All set: Alarm (alarm_id: 9) is now 7:00 AM daily, renamed to 'Morning run', and will show the confirmation screen.""]"	Actually, set that alarm to 7:00 AM from Monday to Friday, and keep the 'Morning workout' label.	Set alarm_no9 to 7:00 AM from Monday to Friday, and keep the 'Morning workout' label.	{'plan': 'ACTION_EDIT_ALARM', 'arguments': {'alarm_id': 9, 'EXTRA_HOUR': 7, 'EXTRA_MINUTES': 0, 'EXTRA_MESSAGE': 'Morning workout', 'EXTRA_DAYS': ['Monday', 'Tuesday', 'Wednesday', 'Thursday', 'Friday']}}	ACTION_SET_ALARM-552-ACTION_SHOW_ALARMS-1-ACTION_EDIT_ALARM-1-ACTION_EDIT_ALARM-1	['ACTION_EDIT_ALARM', 'open_settings', 'ACTION_NAVIGATE_TO_LOCATION', 'send_email', 'send_message']	1.0	ACTION_EDIT_ALARM
"[""turn 1: Set a weekday alarm at 6 AM labeled 'Time to work'. -> Your new alarm (ID: alarm_no1) is set to repeat Monday through Friday at 6:00 AM with the label 'Time to work'."", ""turn 2: Show my alarms -> You have one active alarm: [alarm_no1 – 6:00 AM Mon–Fri, labeled 'Time to work']."", ""turn 3: Add one at 7:30 AM on Monday, Wednesday, and Friday labeled 'Gym' -> Great, I’ve scheduled your 'Gym' alarm (ID: alarm_no10) for 7:30 AM on Mondays, Wednesdays, and Fridays."", 'turn 4: Could you get the video camera app running? I need to capture some moments on video. -> Video camera is now open. You can start recording.']"	Change it to 5:45 AM, disable vibration, and skip confirmation UI	Change 'alarm_no10' to 5:45 AM, disable vibration, and skip confirmation UI	{'plan': 'ACTION_EDIT_ALARM', 'arguments': {'alarm_id': 10, 'EXTRA_HOUR': 5, 'EXTRA_MINUTES': 45, 'EXTRA_VIBRATE': False, 'EXTRA_SKIP_UI': True}}	ACTION_SET_ALARM-544-ACTION_SHOW_ALARMS-1-ACTION_SET_ALARM-1-INTENT_ACTION_VIDEO_CAMERA-1_NR-ACTION_EDIT_ALARM-1	['ACTION_EDIT_ALARM', 'web_search', 'ACTION_VIEW_SENT_MESSAGES', 'ACTION_VIEW_CONTACT', 'send_message']	1.0	ACTION_EDIT_ALARM
"[""turn 1: Alarm 26 should be at 16:35 every Wednesday with 'uri://pop_tune' ringtone. -> Alarm 26 updated to 4:35\xa0PM every Wednesday using the 'uri://pop_tune' ringtone."", 'turn 2: Help me select a mailing address from my saved contacts. -> There you go! Mailing address selected: content://contacts/address/15', 'turn 3: Let me see content://contacts/address/15 details. -> Done! Opening the mailing address details for content://contacts/address/15.', 'turn 4: Edit content://contacts/address/15 and change the address to 789 Oak Street, Springfield. -> Your mailing address now reads 789 Oak Street, Springfield at content://contacts/address/15.']"	Add this contact's phone number as 789-456-1230 and email as example15@domain.com	Add content://contacts/address/15 contact's phone number as 789-456-1230 and email as example15@domain.com	{'plan': 'ACTION_EDIT_CONTACT', 'arguments': {'contact_uri': 'content://contacts/address/15', 'contact_info': {'phone': '789-456-1230', 'email': 'example15@domain.com'}}}	ACTION_EDIT_ALARM-1660-ACTION_PICK-1_NR-ACTION_VIEW_CONTACT-1-ACTION_EDIT_CONTACT-1-ACTION_EDIT_CONTACT-1	['ACTION_VIDEO_CAPTURE', 'ACTION_GET_RINGTONE', 'ACTION_EDIT_CONTACT', 'ACTION_VIEW_PLAYLIST', 'launch_application']	3.0	ACTION_EDIT_CONTACT
"[""turn 1: Show me what's listed in content://contacts/people/1024. -> Displaying record:\nName: Liam Martin\nPhone: (555) 789-0123\nEmail: liam.martin@example.io\nURI: content://contacts/people/1024"", 'turn 2: Need to acquire the email address for the contact at /contacts/lily-email. -> Lily’s email address at /contacts/lily-email is lily.adams@example.net.']"	Update that contact's email to lily.updated@example.com	Update content://contacts/people/1024's email to lily.updated@example.com	{'plan': 'ACTION_EDIT_CONTACT', 'arguments': {'contact_uri': 'content://contacts/people/1024', 'contact_info': {'email': 'lily.updated@example.com'}}}	ACTION_VIEW_CONTACT-776-get_contact_info-1_NR-ACTION_EDIT_CONTACT-1	['dial', 'ACTION_SHOW_TIMERS', 'ACTION_EDIT_CONTACT', 'get_contact_info', 'ACTION_OPEN_DOCUMENT']		ACTION_EDIT_CONTACT
['turn 1: Could you let me choose a number to call from contacts? -> Certainly—displaying your contact phone numbers. Please select one to call.', 'turn 2: I need a complete summary of the contact details for /contacts/alexander. -> Complete details for /contacts/alexander:\nName: Alexander\nPhone: (404) 555-0168\nEmail: alexander@contacts.org\nAddress: 56 Pine Street, Atlanta, GA', 'turn 3: Could I have the phone number stored at contact://tel/0011223344? -> Sure, here’s the number: (001) 122‑3344.']	Change that contact's name to Alex Johnson.	Change the name of /contacts/alexander to Alex Johnson.	{'plan': 'ACTION_EDIT_CONTACT', 'arguments': {'contact_uri': '/contacts/alexander', 'contact_info': {'name': 'Alex Johnson'}}}	ACTION_PICK-530-get_contact_info-1_NR-get_contact_info_from_uri-1_NR-ACTION_EDIT_CONTACT-1	['ACTION_CREATE_DOCUMENT', 'ACTION_VIEW_EVENT', 'ACTION_VIEW_RECENT_APPS', 'ACTION_SET_ALARM', 'ACTION_EDIT_CONTACT']	2.0	ACTION_EDIT_CONTACT
