conversation_history	query	rewrited_query	answer	unique_idx	candidates	refered_turn	plan
"[""turn 1: Remind my dentist at appointments@dentalcare.com about my check-up next Monday. Subject should read 'Appointment Reminder'. -> Appointment Reminder emailed to appointments@dentalcare.com."", ""turn 2: Could you show me the Appointment Reminder email I just sent? -> Sent emails: to appointments@dentalcare.com - 'Appointment Reminder'""]"	Show that email I sent to appointments@dentalcare.com about my check-up next Monday.	Show the email sent to appointments@dentalcare.com about my check-up next Monday.	{'plan': 'ACTION_VIEW_SENT_EMAILS', 'arguments': {}}	send_email-1211-ACTION_VIEW_SENT_EMAILS-1-ACTION_VIEW_SENT_EMAILS-1	['ACTION_VIEW_SENT_EMAILS', 'ACTION_NAVIGATE_TO_LOCATION', 'ACTION_VIEW_RECENT_APPS', 'play_video', 'ACTION_SET_ALARM']	1.0	ACTION_VIEW_SENT_EMAILS
"['turn 1: Could you let me choose multiple text files for batch processing? -> Sure thing! Select all the text files you want to include.', 'turn 2: Email all the text files you want to include to editor@company.com -> Your batch of text files has been emailed to editor@company.com.', ""turn 3: Can I see what I just sent to editor@company.com? -> Sent emails: to editor@company.com - 'Text files batch'.""]"	Can I see my sent mail?	View sent emails	{'plan': 'ACTION_VIEW_SENT_EMAILS', 'arguments': {}}	ACTION_GET_CONTENT-177-send_email-1-ACTION_VIEW_SENT_EMAILS-1-ACTION_VIEW_SENT_EMAILS-12	['ACTION_VIEW_WEB_HISTORY', 'launch_application', 'ACTION_VIEW_SENT_EMAILS', 'ACTION_VIEW_RECENT_APPS', 'ACTION_CREATE_DOCUMENT']	2.0	ACTION_VIEW_SENT_EMAILS
"['turn 1: Open camera to capture scene. -> Done! Scene captured—check it out at content://external_media/100/photos/scene_01.jpg.', ""turn 2: I'm trying to open one PDF file that I can work on later; please open the file picker. -> Okay, pulling up the PDF file selection interface. Go ahead and pick the one you’d like."", ""turn 3: Email content://external_media/100/photos/scene_01.jpg to editor@example.com with subject 'Review request.' -> Your email with the attachment has been sent to editor@example.com.""]"	Show it in my sent folder.	Show content://external_media/100/photos/scene_01.jpg in my sent folder.	{'plan': 'ACTION_VIEW_SENT_EMAILS', 'arguments': {}}	ACTION_IMAGE_CAPTURE-368-ACTION_OPEN_DOCUMENT-1_NR-send_email-1-ACTION_VIEW_SENT_EMAILS-1	['send_email', 'ACTION_VIEW_SENT_EMAILS', 'web_search', 'play_video', 'dial']		ACTION_VIEW_SENT_EMAILS
"[""turn 1: I want to dispatch an email to contact@vendor.org with subject 'RFQ Submission' and attach file:///rfq.docx and file:///pricing.xlsx. -> RFQ Submission email sent to contact@vendor.org with both RFQ and pricing files attached."", ""turn 2: Can you open an image file for me? I'm looking for persistent access to it. -> Image loaded for long‑term access: content://pictures/favorites/photo123.png"", ""turn 3: Create a new image file for editing content://pictures/favorites/photo123.png called photo123_edited.png -> Your new PNG 'photo123_edited.png' is set up at content://images/photo123_edited.png. Go ahead and apply your edits.""]"	Let me review my sent emails	Review sent emails	{'plan': 'ACTION_VIEW_SENT_EMAILS', 'arguments': {}}	send_email-1225-ACTION_OPEN_DOCUMENT-1_NR-ACTION_CREATE_DOCUMENT-1-ACTION_VIEW_SENT_EMAILS-1	['play_music', 'ACTION_VIEW_PLAYLIST', 'ACTION_VIEW_SENT_EMAILS', 'INTENT_ACTION_STILL_IMAGE_CAMERA', 'ACTION_SET_ALARM']	1.0	ACTION_VIEW_SENT_EMAILS
"[""turn 1: I want to dispatch an email to contact@vendor.org with subject 'RFQ Submission' and attach file:///rfq.docx and file:///pricing.xlsx. -> RFQ Submission email sent to contact@vendor.org with both RFQ and pricing files attached."", ""turn 2: Can you open an image file for me? I'm looking for persistent access to it. -> Image loaded for long‑term access: content://pictures/favorites/photo123.png""]"	Could you display my sent emails?	Display my sent emails	{'plan': 'ACTION_VIEW_SENT_EMAILS', 'arguments': {}}	send_email-1225-ACTION_OPEN_DOCUMENT-1_NR-ACTION_VIEW_SENT_EMAILS-1	['get_contact_info', 'ACTION_GET_RINGTONE', 'ACTION_OPEN_CONTENT', 'send_email', 'ACTION_VIEW_SENT_EMAILS']	1.0	ACTION_VIEW_SENT_EMAILS
"[""turn 1: Start recording video now. -> I've captured your video. Check it out here: content://videos/recording_003.mp4."", 'turn 2: Email content://videos/recording_003.mp4 to editor@publish.com -> Your video has been sent to editor@publish.com.', ""turn 3: What have I sent from my Sent folder? -> Sent emails:\n• to editor@publish.com - 'recording_003.mp4'""]"	Show that video email in my sent folder	Show the sent email containing content://videos/recording_003.mp4 in my sent folder	{'plan': 'ACTION_VIEW_SENT_EMAILS', 'arguments': {}}	ACTION_VIDEO_CAPTURE-709-send_email-1-ACTION_VIEW_SENT_EMAILS-1-ACTION_VIEW_SENT_EMAILS-1	['ACTION_VIEW_SENT_MESSAGES', 'ACTION_VIEW_RECENT_APPS', 'ACTION_CREATE_DOCUMENT', 'ACTION_VIEW_SENT_EMAILS', 'ACTION_GET_RINGTONE']	2.0	ACTION_VIEW_SENT_EMAILS
"[""turn 1: Message my neighbor at +44 7312 345678: 'Could you feed my cat while I'm away?' -> Request sent to your neighbor at +447312345678."", ""turn 2: What messages have I sent? -> Sent messages: +447312345678 – 'Could you feed my cat while I'm away?'."", ""turn 3: I would like to set up an event titled 'Art Exhibition'. It's a public display of local art at Downtown Gallery from 1701100000000 to 1701103600000. -> Great news—‘Art Exhibition’ has been scheduled for November 17 at Downtown Gallery. View it here: content://calendar/event/15"", 'turn 4: Give me the information on content://calendar/event/15. -> Art Exhibition – Public display of local art at Downtown Gallery on November 17, 9:00\xa0AM–10:00\xa0AM.']"	Can you show me that sent message?	Can you show me +447312345678 – 'Could you feed my cat while I'm away?'?	{'plan': 'ACTION_VIEW_SENT_MESSAGES', 'arguments': {}}	send_message-1287-ACTION_VIEW_SENT_MESSAGES-1-ACTION_INSERT_EVENT-1_NR-ACTION_VIEW_EVENT-1-ACTION_VIEW_SENT_MESSAGES-1	['ACTION_VIEW_RECENT_APPS', 'INTENT_ACTION_VIDEO_CAMERA', 'ACTION_VIEW_SENT_MESSAGES', 'ACTION_VIEW_CALL_LOG', 'ACTION_PICK']	1.0	ACTION_VIEW_SENT_MESSAGES
"['turn 1: Could you let me choose multiple text files for batch processing? -> Sure thing! Select all the text files you want to include.', ""turn 2: Send all the text files you want to include to me saying 'Batch files attached.' -> Your batch message 'Batch files attached.' has been delivered to you along with the selected text files."", 'turn 3: Could you deliver the address info for the URI /user/contact/paul? -> Got it—Paul’s address is 742 Evergreen Terrace, Springfield, IL 62704.']"	Display the message I sent to myself.	Display the message I sent to myself with the content 'Batch files attached.'	{'plan': 'ACTION_VIEW_SENT_MESSAGES', 'arguments': {}}	ACTION_GET_CONTENT-177-send_message-1-get_contact_info-1_NR-ACTION_VIEW_SENT_MESSAGES-1	['ACTION_VIEW_SENT_MESSAGES', 'ACTION_GET_CONTENT', 'ACTION_SHOW_ALARMS', 'dial', 'ACTION_SET_RINGTONE']	2.0	ACTION_VIEW_SENT_MESSAGES
"['turn 1: Capture a quick video. -> Done! Your video has been recorded. Here’s the URI: content://videos/quickcap_001.mp4', 'turn 2: Text content://videos/quickcap_001.mp4 to mom with the message \'Look what I recorded!\' -> Video and message sent to mom: ""Look what I recorded!""', ""turn 3: I want to see my sent messages. -> Sent messages: Mom – 'Look what I recorded!' (video at content://videos/quickcap_001.mp4)""]"	Show me the sent messages including that video and message to mom.	"Show me the sent messages including the video and message sent to mom: ""Look what I recorded!""."	{'plan': 'ACTION_VIEW_SENT_MESSAGES', 'arguments': {}}	ACTION_VIDEO_CAPTURE-706-send_message-1-ACTION_VIEW_SENT_MESSAGES-1-ACTION_VIEW_SENT_MESSAGES-1	['ACTION_VIEW_SENT_MESSAGES', 'play_video', 'ACTION_VIEW_EVENT', 'search_location', 'ACTION_CREATE_DOCUMENT']	2.0	ACTION_VIEW_SENT_MESSAGES
"[""turn 1: Please text +39 02 1234 5678: 'The Milan office code has changed to 4567.' -> Office code update text sent to +390212345678."", ""turn 2: List my recent sent messages -> Sent messages: +390212345678 – 'The Milan office code has changed to 4567.'."", ""turn 3: I need a calendar entry for 'Evening Webinar' about business trends. It is an online session, so no location is required, and it's scheduled from 1701400000000 to 1701405400000. -> All set! ‘Evening Webinar’ (online session about business trends) is scheduled for November 20. View here: content://calendar/event/12"", 'turn 4: Show me content://calendar/event/12 details. -> Evening Webinar – Online session on business trends, November 20 from 5:00\xa0PM to 6:30\xa0PM.']"	Show the last message I sent.	Show 'The Milan office code has changed to 4567.'.	{'plan': 'ACTION_VIEW_SENT_MESSAGES', 'arguments': {}}	send_message-1290-ACTION_VIEW_SENT_MESSAGES-1-ACTION_INSERT_EVENT-1_NR-ACTION_VIEW_EVENT-1-ACTION_VIEW_SENT_MESSAGES-1	['ACTION_SET_ALARM', 'ACTION_INSERT_CONTACT', 'ACTION_VIEW_SENT_MESSAGES', 'ACTION_INSERT_EVENT', 'ACTION_VIEW_RECENT_APPS']	1.0	ACTION_VIEW_SENT_MESSAGES
"[""turn 1: Send a quick reminder to John at +15551234567 saying 'Don't forget the meeting at 3pm today.' -> Your reminder has been sent to +15551234567."", 'turn 2: Give +15551234567 a quick call -> Initiating call to +15551234567...', 'turn 3: Create a new contact with +15551234567 -> Initiating contact setup: +15551234567 is entered.', 'turn 4: Find +15551234567\'s address using the map app -> Opening map search for ""+15551234567"" now.']"	Show that reminder I sent.	Show the reminder I sent to John at +15551234567 saying 'Don't forget the meeting at 3pm today.'	{'plan': 'ACTION_VIEW_SENT_MESSAGES', 'arguments': {}}	send_message-1241-dial-1-ACTION_INSERT_CONTACT-1-search_location-1-ACTION_VIEW_SENT_MESSAGES-1	['ACTION_EDIT_CONTACT', 'INTENT_ACTION_VIDEO_CAMERA', 'ACTION_VIEW_CALL_LOG', 'ACTION_VIEW_SENT_MESSAGES', 'ACTION_SET_RINGTONE']	1.0	ACTION_VIEW_SENT_MESSAGES
"['turn 1: Please remind me at noon to take my lunch break every weekday. -> Got it! Alarm (alarm_no8) scheduled for 12:00 PM Monday through Friday: Take my lunch break.', ""turn 2: Schedule a 'Breakfast Meetup' for an early morning networking event. There is no specific location. It should run from 1701200000000 to 1701201800000. -> ‘Breakfast Meetup’ (Early morning networking event) has been added from 1701200000000 to 1701201800000. Event URI: content://calendar/event/4"", 'turn 3: Shoot me a message with content://calendar/event/4 schedule -> Your schedule info for event 4 has been sent to you.', ""turn 4: I want to add a new event called 'Strategy Session' to plan the next quarter's objectives in the Executive Boardroom. Schedule it from 1701900000000 to 1701907200000. -> Got it! 'Strategy Session' is scheduled in the Executive Boardroom (Planning the next quarter's objectives) from 1701900000000 to 1701907200000. You can open it here: content://calendar/event/108""]"	Show that schedule message you sent me.	Show the schedule message with content://calendar/event/4 schedule you sent me.	{'plan': 'ACTION_VIEW_SENT_MESSAGES', 'arguments': {}}	ACTION_SET_ALARM-561-ACTION_INSERT_EVENT-1_NR-send_message-1-ACTION_INSERT_EVENT-1_NR-ACTION_VIEW_SENT_MESSAGES-1	['ACTION_EDIT_VIDEO', 'get_contact_info_from_uri', 'ACTION_VIEW_WEB_HISTORY', 'send_message', 'ACTION_VIEW_SENT_MESSAGES']	3.0	ACTION_VIEW_SENT_MESSAGES
"['turn 1: Would you mind showing the record located at content://contacts/people/1025? -> Sure, here’s what’s on file:\n• Sophia Wilson\n• 📞 (555) 890-1234\n• 📧 sophia.wilson@example.com\nRecord URI: content://contacts/people/1025', 'turn 2: I need a document viewer to pick a plain text file – please open the file dialog for text documents. -> Sure thing! You can access the file here: content://docs/readme.txt', ""turn 3: Send content://docs/readme.txt to Mike at +1-555-210-7890 with a note 'Please take a look at this readme file.' -> Message with the readme file sent to +1-555-210-7890.""]"	Show the message I sent to him.	Show the message I sent to +1-555-210-7890.	{'plan': 'ACTION_VIEW_SENT_MESSAGES', 'arguments': {}}	ACTION_VIEW_CONTACT-777-ACTION_OPEN_DOCUMENT-1_NR-send_message-1-ACTION_VIEW_SENT_MESSAGES-1	['INTENT_ACTION_STILL_IMAGE_CAMERA', 'search_location', 'ACTION_NAVIGATE_TO_LOCATION', 'ACTION_INSERT_CONTACT', 'ACTION_VIEW_SENT_MESSAGES']		ACTION_VIEW_SENT_MESSAGES
"[""turn 1: Could you buzz the client at +1 212 555 0148: 'Invoice #12345 is due tomorrow.' -> Sent! 'Invoice #12345 is due tomorrow.' has been delivered to +12125550148."", 'turn 2: Select from my saved contacts. -> Opening your contacts now—please choose a contact.']"	Show the message I just buzzed.	Show the message I just buzzed to +12125550148.	{'plan': 'ACTION_VIEW_SENT_MESSAGES', 'arguments': {}}	send_message-1291-ACTION_PICK-1_NR-ACTION_VIEW_SENT_MESSAGES-1	['get_contact_info_from_uri', 'dial', 'ACTION_EDIT_CONTACT', 'ACTION_VIEW_SENT_MESSAGES', 'ACTION_SET_RINGTONE']	1.0	ACTION_VIEW_SENT_MESSAGES
"[""turn 1: Forward the holiday greeting 'Merry Christmas and a Happy New Year!' to +81-90-1234-5678. -> Merry Christmas greeting sent to +81-90-1234-5678."", 'turn 2: Make a call to +81-90-1234-5678 -> Calling +81-90-1234-5678...']"	Let me review that holiday greeting I forwarded.	Let me review the holiday greeting 'Merry Christmas and a Happy New Year!' I forwarded to +81-90-1234-5678.	{'plan': 'ACTION_VIEW_SENT_MESSAGES', 'arguments': {}}	send_message-1244-dial-1-ACTION_VIEW_SENT_MESSAGES-1	['ACTION_VIEW_SENT_MESSAGES', 'INTENT_ACTION_VIDEO_CAMERA', 'ACTION_VIEW_WEB_HISTORY', 'ACTION_INSERT_EVENT', 'ACTION_VIDEO_CAPTURE']	1.0	ACTION_VIEW_SENT_MESSAGES
"[""turn 1: Tell the on-call doctor at +1-617-555-0199: 'Patient in room 210 needs vital check.' -> Message delivered to the on-call doctor at +16175550199.""]"	Show me that message to the on-call doctor and my other sent messages.	Show me 'Patient in room 210 needs vital check.' to the on-call doctor and my other sent messages.	{'plan': 'ACTION_VIEW_SENT_MESSAGES', 'arguments': {}}	send_message-1285-ACTION_VIEW_SENT_MESSAGES-1	['ACTION_SET_ALARM', 'ACTION_VIDEO_CAPTURE', 'launch_application', 'ACTION_VIEW_EVENT', 'ACTION_VIEW_SENT_MESSAGES']		ACTION_VIEW_SENT_MESSAGES
"['turn 1: Display my web history, please. -> Your last visited URLs: Amazon – Today’s Deals (amazon.com/deals); Spotify – Daily Mix (open.spotify.com); Wikipedia – Machine Learning (en.wikipedia.org/wiki/Machine_learning); Twitter – Home (twitter.com/home).', ""turn 2: Search en.wikipedia.org/wiki/Machine_learning Machine Learning page again. -> Search results for 'en.wikipedia.org/wiki/Machine_learning': a comprehensive overview of machine learning concepts, history, and key algorithms."", 'turn 3: Let me view Amazon – Today’s Deals (amazon.com/deals); Spotify – Daily Mix (open.spotify.com); Wikipedia – Machine Learning (en.wikipedia.org/wiki/Machine_learning); Twitter – Home (twitter.com/home). -> Displaying your latest visits: Amazon – Today’s Deals (amazon.com/deals); Spotify – Daily Mix (open.spotify.com); Wikipedia – Machine Learning (en.wikipedia.org/wiki/Machine_learning); Twitter – Home (twitter.com/home).']"	Show my recent web history, especially that Machine Learning page search.	Show my recent web history, especially the search for en.wikipedia.org/wiki/Machine_learning.	{'plan': 'ACTION_VIEW_WEB_HISTORY', 'arguments': {}}	ACTION_VIEW_WEB_HISTORY-2054-web_search-1-ACTION_VIEW_WEB_HISTORY-1-ACTION_VIEW_WEB_HISTORY-1	['ACTION_INSERT_CONTACT', 'ACTION_VIEW_WEB_HISTORY', 'send_message', 'ACTION_SET_TIMER', 'ACTION_OPEN_DOCUMENT']	2.0	ACTION_VIEW_WEB_HISTORY
"['turn 1: I need to select both images and videos. -> Understood. Please select the images and videos you need—you can pick more than one.', ""turn 2: I'm looking for reviews of the top fitness trackers right now; can you search that for me? -> Searching for 'reviews of top fitness trackers'... Comparing options like Fitbit, Apple\xa0Watch, Garmin, and their key features."", 'turn 3: Select one person from my contacts database. -> Contact picked: content://contacts/people/3']"	Can you show me my recent web history?	View web browsing history	{'plan': 'ACTION_VIEW_WEB_HISTORY', 'arguments': {}}	ACTION_OPEN_DOCUMENT-157-web_search-1_NR-ACTION_PICK-1_NR-ACTION_VIEW_WEB_HISTORY-24	['dial', 'ACTION_SET_RINGTONE', 'ACTION_GET_CONTENT', 'ACTION_VIEW_WEB_HISTORY', 'ACTION_EDIT_CONTACT']	2.0	ACTION_VIEW_WEB_HISTORY
"['turn 1: What have I been clicking around recently? -> Recent sites visited: Google search (best noise cancelling headphones); Wikipedia | Active Noise Control; YouTube video on Sony WH-1000XM4; Amazon Bose QuietComfort 35 II page; OpenAI Blog GPT-4 Release; Reddit r/headphones.', ""turn 2: Search Amazon Bose QuietComfort 35 II page again. -> Search results for 'Bose QuietComfort 35 II Amazon': Amazon product listing featuring Bose QC35 II headphones, detailed specs, current pricing, and verified customer reviews."", ""turn 3: Create an event titled 'Music Rehearsal' for a band practice session. It will take place at Studio 7 starting at 1701500000000 and ending at 1701503600000. -> Done! ‘Music Rehearsal’ is on November 21 at Studio 7. You can open it here: content://calendar/event/11""]"	I want to check my browsing history	I want to check web browsing history	{'plan': 'ACTION_VIEW_WEB_HISTORY', 'arguments': {}}	ACTION_VIEW_WEB_HISTORY-2087-web_search-1-ACTION_INSERT_EVENT-1_NR-ACTION_VIEW_WEB_HISTORY-1	['web_search', 'ACTION_SHOW_ALARMS', 'ACTION_VIEW_WEB_HISTORY', 'play_music', 'INTENT_ACTION_VIDEO_CAMERA']	2.0	ACTION_VIEW_WEB_HISTORY
"[""turn 1: Forward this message to +91 98765 43210: 'Join the yoga session at 7 AM.' -> Yoga session invite forwarded successfully to +919876543210."", ""turn 2: Could you search for the latest trends in sustainable architecture? -> Search results for 'latest sustainable architecture trends': Insights on passive design, green roofs, and net-zero building techniques."", 'turn 3: Pull up my recent web history. -> Here’s what’s in your recent history: Google Search “latest sustainable architecture trends” (google.com/search?q=latest+sustainable+architecture+trends); ArchDaily – Passive Design Strategies (archdaily.com/strategy/passive-design); USGBC – Net Zero Building Techniques (usgbc.org/net-zero); Dezeen – Green Roof Inspirations (dezeen.com/tag/green-roofs).']"	I'd like to check my web browsing history following that search on sustainable architecture trends.	I'd like to check my web browsing history following the search for 'the latest trends in sustainable architecture'.	{'plan': 'ACTION_VIEW_WEB_HISTORY', 'arguments': {}}	send_message-1293-web_search-1_NR-ACTION_VIEW_WEB_HISTORY-1-ACTION_VIEW_WEB_HISTORY-1	['ACTION_VIEW_CONTACT', 'get_contact_info_from_uri', 'ACTION_VIEW_PLAYLIST', 'ACTION_VIEW_SENT_EMAILS', 'ACTION_VIEW_WEB_HISTORY']	2.0	ACTION_VIEW_WEB_HISTORY
"[""turn 1: Recommended vaccination schedule for infants in the US. -> Searching 'recommended vaccination schedule for infants in the US'... Preview: HepB at birth, DTaP & IPV at 2 months, Hib & PCV13 following schedule thereafter."", 'turn 2: Could you bring up my recent browsing sessions? -> Here are your recent sessions: CDC (vaccine schedule); WebMD (immunization tips); PubMed (research paper); YouTube (health seminar)']"	Display my recent web activity.	View web browsing history	{'plan': 'ACTION_VIEW_WEB_HISTORY', 'arguments': {}}	web_search-1335-ACTION_VIEW_WEB_HISTORY-1_NR-ACTION_VIEW_WEB_HISTORY-18	['web_search', 'ACTION_SET_ALARM', 'ACTION_GET_CONTENT', 'ACTION_VIEW_EVENT', 'ACTION_VIEW_WEB_HISTORY']	1.0	ACTION_VIEW_WEB_HISTORY
"[""turn 1: I’d like to review what I recently viewed online. -> Here's what you've been clicking on lately: Google – best noise-cancelling headphones; Wikipedia – Active Noise Control; YouTube – Sony WH-1000XM4 Review; Amazon – Bose QC35 II; OpenAI Blog – GPT-4; Reddit – r/headphones."", ""turn 2: Look up YouTube – Sony WH-1000XM4 Review again. -> Here are the search results for 'Sony WH-1000XM4 Review YouTube': YouTube video reviews evaluating the Sony WH-1000XM4 headphones’ sound quality, comfort, and noise-cancellation performance."", 'turn 3: Kindly display the websites I have visited in the past few minutes. -> Of course! Your latest visits include: YouTube – “Sony WH-1000XM4 unboxing”; Twitter – #WH1000XM4; CNET review; Best\xa0Buy – Headphones; SoundGuys – comparative tests.']"	Please open my browsing history after that Sony WH-1000XM4 review search on YouTube.	Please open my web browsing history after the YouTube search for 'Sony WH-1000XM4 Review'.	{'plan': 'ACTION_VIEW_WEB_HISTORY', 'arguments': {}}	ACTION_VIEW_WEB_HISTORY-2086-web_search-1-ACTION_VIEW_WEB_HISTORY-1_NR-ACTION_VIEW_WEB_HISTORY-1	['ACTION_VIEW_RECENT_APPS', 'INTENT_ACTION_STILL_IMAGE_CAMERA', 'ACTION_VIEW_WEB_HISTORY', 'ACTION_INSERT_CONTACT', 'ACTION_SET_ALARM']	2.0	ACTION_VIEW_WEB_HISTORY
"['turn 1: List the remaining countdowns. -> Remaining countdowns: 5 minutes - Sauce, 8 minutes - Break.', ""turn 2: I'm looking for detailed reports on the impact of social media on society. -> Search results for 'impact of social media on society reports': In‑depth studies on mental health effects, political mobilization trends, and social cohesion analyses."", 'turn 3: Let me see my browsing history for In‑depth studies on mental health effects, political mobilization trends, and social cohesion analyses. -> Here are your browsing entries: Google Search “impact of social media on society reports” (google.com/search?q=impact+of+social+media+on+society+reports); Journal of Social Media Studies – Mental Health Effects (jsms.org/mental-health); Pew Research – Political Mobilization Trends (pewresearch.org/social-media-politics); MIT Sloan – Social Cohesion Analyses (sloanreview.mit.edu/social-cohesion).']"	What websites have I looked at lately?	List web browsing history	{'plan': 'ACTION_VIEW_WEB_HISTORY', 'arguments': {}}	ACTION_SHOW_TIMERS-1886-web_search-1_NR-ACTION_VIEW_WEB_HISTORY-1-ACTION_VIEW_WEB_HISTORY-1	['INTENT_ACTION_STILL_IMAGE_CAMERA', 'ACTION_VIEW_WEB_HISTORY', 'get_contact_info', 'INTENT_ACTION_VIDEO_CAMERA', 'open_settings']	2.0	ACTION_VIEW_WEB_HISTORY
"['turn 1: Let me see all my recently opened web pages. -> Your recent web activity shows: Skype Web (web.skype.com); Stack Overflow – C# question (stackoverflow.com/q/67890); Yahoo Mail (mail.yahoo.com); Duolingo – Spanish lessons (duolingo.com/learn).', ""turn 2: Search stackoverflow.com/q/67890. -> Here’s what I found for 'stackoverflow.com/q/67890': A C# Q&A on exception handling and performance optimization."", ""turn 3: I'd like to see my recent visits -> Here are your recent visits: Skype Web; Stack Overflow – C# question; Yahoo Mail; Duolingo – Spanish lessons.""]"	I want to view my browsing history.	View web browsing history	{'plan': 'ACTION_VIEW_WEB_HISTORY', 'arguments': {}}	ACTION_VIEW_WEB_HISTORY-2060-web_search-1-ACTION_VIEW_WEB_HISTORY-1-ACTION_VIEW_WEB_HISTORY-26	['ACTION_SET_ALARM', 'ACTION_SET_RINGTONE', 'ACTION_OPEN_CONTENT', 'ACTION_GET_RINGTONE', 'ACTION_VIEW_WEB_HISTORY']	2.0	ACTION_VIEW_WEB_HISTORY
"[""turn 1: Common symptoms associated with type 2 diabetes. -> Searching for 'common symptoms of type 2 diabetes'... Preview: fatigue, frequent urination, increased thirst, blurred vision and slow-healing wounds are commonly listed."", 'turn 2: I want to choose one PDF document for permanent access. Please open the file chooser. -> Opening the PDF-only picker. Choose a single PDF document for permanent access.']"	I'd like to see the pages I've visited recently.	View web browsing history	{'plan': 'ACTION_VIEW_WEB_HISTORY', 'arguments': {}}	web_search-1326-ACTION_OPEN_DOCUMENT-1_NR-ACTION_VIEW_WEB_HISTORY-29	['ACTION_VIEW_WEB_HISTORY', 'ACTION_SET_RINGTONE', 'ACTION_PICK', 'play_video', 'ACTION_SET_ALARM']	1.0	ACTION_VIEW_WEB_HISTORY
"[""turn 1: Best practices to boost productivity when working remotely. -> Opening search for 'best practices for remote work productivity': You'll see articles on time management, communication tools, and workspace setup."", ""turn 2: Please open my recent browsing record. -> Opening your recent browsing record: Google (search 'best coffee shops'), OpenAI Blog, YouTube (music playlist), Spotify (web player), Wikipedia (Python).""]"	What sites did I check for that topic?	What sites did I check for the topic 'Best practices to boost productivity when working remotely'?	{'plan': 'ACTION_VIEW_WEB_HISTORY', 'arguments': {}}	web_search-1346-ACTION_VIEW_WEB_HISTORY-1_NR-ACTION_VIEW_WEB_HISTORY-1	['dial', 'ACTION_GET_CONTENT', 'ACTION_VIEW_WEB_HISTORY', 'send_message', 'ACTION_VIEW_CONTACT']	1.0	ACTION_VIEW_WEB_HISTORY
['turn 1: Get the phone entry from content://com.example.contacts/1001. -> Got it. The phone number for content://com.example.contacts/1001 is 555-123-4567.', 'turn 2: Open content://com.example.contacts/1001 contact -> Opening content://com.example.contacts/1001. Phone: 555-123-4567. You can view email and address in the full contact view.', 'turn 3: Please open the Books app so I can read an eBook. -> Books app launched successfully. Enjoy your reading!']	Call that number	Call 555-123-4567	{'plan': 'dial', 'arguments': {'phone_number': '555-123-4567'}}	get_contact_info-1009-ACTION_VIEW_CONTACT-1-launch_application-1_NR-dial-3	['send_email', 'dial', 'ACTION_EDIT_CONTACT', 'ACTION_VIEW_EVENT', 'get_contact_info_from_uri']	2.0	dial
